title,singer,lyric,genre
Cờ Bay Cao Chiếu Sáng Việt Nam,V.A, hiện chưa có lời bài hát nào cho cờ bay cao chiếu sáng việt nam do ca sĩ va trình bày bạn có thể click vào đây để đăng lời cho bài hát này,cach-mang
Quốc Ấn Đại Việt,Mạnh Cường, hiện chưa có lời bài hát nào cho quốc ấn đại việt do ca sĩ mạnh cường trình bày bạn có thể click vào đây để đăng lời cho bài hát này,cach-mang
Âm Vang Tiếng Khèn,Hải Yến, hiện chưa có lời bài hát nào cho âm vang tiếng khèn do ca sĩ hải yến trình bày bạn có thể click vào đây để đăng lời cho bài hát này,cach-mang
Hào Khí Việt Nam,Trần Minh Tuấn, hiện chưa có lời bài hát nào cho hào khí việt nam do ca sĩ trần minh tuấn trình bày bạn có thể click vào đây để đăng lời cho bài hát này,cach-mang
Hải Phòng Thành Phố Hoa Phượng Đỏ,Thế Hùng, hiện chưa có lời bài hát nào cho hải phòng thành phố hoa phượng đỏ do ca sĩ thế hùng trình bày bạn có thể click vào đây để đăng lời cho bài hát này,cach-mang
Cờ Bay Cao Chiếu Sáng,"Đức Thọ, Việt Long", hiện chưa có lời bài hát nào cho cờ bay cao chiếu sáng do ca sĩ đức thọ việt long trình bày bạn có thể click vào đây để đăng lời cho bài hát này,cach-mang
Tình Yêu Cô Gái Dao,Thanh Hương, hiện chưa có lời bài hát nào cho tình yêu cô gái dao do ca sĩ thanh hương trình bày bạn có thể click vào đây để đăng lời cho bài hát này,cach-mang
Bài Ca Xây Dựng,Trường Dương, hiện chưa có lời bài hát nào cho bài ca xây dựng do ca sĩ trường dương trình bày bạn có thể click vào đây để đăng lời cho bài hát này,cach-mang
Người Chiến Sĩ Giao Thông,Quốc Hưng (NSƯT), hiện chưa có lời bài hát nào cho người chiến sĩ giao thông do ca sĩ quốc hưng nsưt trình bày bạn có thể click vào đây để đăng lời cho bài hát này,cach-mang
Hà Nội Niềm Tin Và Hy Vọng,Quốc Hưng (NSƯT), hiện chưa có lời bài hát nào cho hà nội niềm tin và hy vọng do ca sĩ quốc hưng nsưt trình bày bạn có thể click vào đây để đăng lời cho bài hát này,cach-mang
Hà Nội Đêm Mùa Đông,Quốc Hưng (NSƯT), hiện chưa có lời bài hát nào cho hà nội đêm mùa đông do ca sĩ quốc hưng nsưt trình bày bạn có thể click vào đây để đăng lời cho bài hát này,cach-mang
Hà Nam Nắng Về,Quốc Hưng (NSƯT), hiện chưa có lời bài hát nào cho hà nam nắng về do ca sĩ quốc hưng nsưt trình bày bạn có thể click vào đây để đăng lời cho bài hát này,cach-mang
Ca Ngợi Hồ Chủ Tịch,Quốc Hưng (NSƯT), hiện chưa có lời bài hát nào cho ca ngợi hồ chủ tịch do ca sĩ quốc hưng nsưt trình bày bạn có thể click vào đây để đăng lời cho bài hát này,cach-mang
Hát Dưới Tượng Đài,Xuân Hảo, hiện chưa có lời bài hát nào cho hát dưới tượng đài do ca sĩ xuân hảo trình bày bạn có thể click vào đây để đăng lời cho bài hát này,cach-mang
Bình Trị Thiên Khói Lửa,Lạc Việt, hiện chưa có lời bài hát nào cho bình trị thiên khói lửa do ca sĩ lạc việt trình bày bạn có thể click vào đây để đăng lời cho bài hát này,cach-mang
Những Ánh Sao Đêm,Quốc Vinh,làn gió thơm hương đêm về quanh khu nhà tôi mới cất xong chiều qua tôi đứng trên tầng gác thật cao nhìn ra chân trời xa xa từ bao mái nhà đèn hoa sáng ngời bầu trời thêm muôn vì sao sáng tôi ngắm bao gia đình lửa ấm tình yêu nghe máu trong tim hoà niềm vui lâng lâng lờ ca em ơi anh còn đi xây nhiều nhà khắp nơi nhiều tổ ấm sống vui tình lứa đôi lòng anh thấy càng thương nhớ em dù xa nhau trọn ngày đêm anh càng yêu em càng hăng say xây cho nhà cao cao mãi ôi xinh đẹp tổ quốc của ta anh lắng nghe bao lời ân ái những bài tình ca lòng nhớ thương quê hương miền nam anh hằng tha thiết mong ngày mai anh sẽ đi về khắp làng quê xây những ngôi nhà tương lai dòng sông mát xanh vòng quanh phố phường và nhiều công trường xây niềm vui mới khi bóng đêm trở về rực ánh đèn lên em thấy như muôn ngàn vì sao thêu trong đêm tối em ơi tuy giờ đây hai miền còn cách xa niềm chia cắt thắt đau lòng chúng ta nhưng không thể xóa được hình bóng em dù xa nhau trọn ngày đêm anh càng yêu em càng hăng say xây cho nhà cao cao mãi ôi xinh đẹp tổ quốc của ta anh lắng nghe bao lời ân ái những bài tình ca,cach-mang
Như Những Đóa San Hô,"Mai Trâm, Lạc Việt", hiện chưa có lời bài hát nào cho như những đóa san hô do ca sĩ mai trâm lạc việt trình bày bạn có thể click vào đây để đăng lời cho bài hát này,cach-mang
Hành Khúc Lữ Đoàn 189,Nguyễn Văn Hiên, hiện chưa có lời bài hát nào cho hành khúc lữ đoàn 189 do ca sĩ nguyễn văn hiên trình bày bạn có thể click vào đây để đăng lời cho bài hát này,cach-mang
Đồng Đội Ơi,Phạm Chiến, hiện chưa có lời bài hát nào cho đồng đội ơi do ca sĩ phạm chiến trình bày bạn có thể click vào đây để đăng lời cho bài hát này,cach-mang
Biên Cương Trong Trái Tim Người Lính,Lạc Việt, hiện chưa có lời bài hát nào cho biên cương trong trái tim người lính do ca sĩ lạc việt trình bày bạn có thể click vào đây để đăng lời cho bài hát này,cach-mang
Tổ Quốc Tôi Chưa Đẹp Thế Bao Giờ,Phan Mạnh Thắng, hiện chưa có lời bài hát nào cho tổ quốc tôi chưa đẹp thế bao giờ do ca sĩ phan mạnh thắng trình bày bạn có thể click vào đây để đăng lời cho bài hát này,cach-mang
Tổ Quốc Con Tàu Và Người Thủy Thủ,Ngô Duy Thanh, hiện chưa có lời bài hát nào cho tổ quốc con tàu và người thủy thủ do ca sĩ ngô duy thanh trình bày bạn có thể click vào đây để đăng lời cho bài hát này,cach-mang
Những Chiến Sĩ Làm Chủ Lòng Đại Dương,"Khánh Vinh, Minh Cường, Cao Tiến Đạt", hiện chưa có lời bài hát nào cho những chiến sĩ làm chủ lòng đại dương do ca sĩ khánh vinh minh cường cao tiến đạt trình bày bạn có thể click vào đây để đăng lời cho bài hát này,cach-mang
Mẹ Tôi,Quốc Hưng (NSƯT), hiện chưa có lời bài hát nào cho mẹ tôi do ca sĩ quốc hưng nsưt trình bày bạn có thể click vào đây để đăng lời cho bài hát này,cach-mang
Chúng Tôi Là Lính Tàu Ngầm,"Y Jang Tuyn, Max Nguyễn, Nguyễn Đức", hiện chưa có lời bài hát nào cho chúng tôi là lính tàu ngầm do ca sĩ y jang tuyn max nguyễn nguyễn đức trình bày bạn có thể click vào đây để đăng lời cho bài hát này,cach-mang
Ngồi Nghe Sóng Kể Chuyện,"Nguyễn Ngọc Thiện, Hữu Đức", hiện chưa có lời bài hát nào cho ngồi nghe sóng kể chuyện do ca sĩ nguyễn ngọc thiện hữu đức trình bày bạn có thể click vào đây để đăng lời cho bài hát này,cach-mang
Hát Về Một Tám Chín,Kông Lương, hiện chưa có lời bài hát nào cho hát về một tám chín do ca sĩ kông lương trình bày bạn có thể click vào đây để đăng lời cho bài hát này,cach-mang
Tự Hào Thành Phố Của Tôi,Phạm Hưng, hiện chưa có lời bài hát nào cho tự hào thành phố của tôi do ca sĩ phạm hưng trình bày bạn có thể click vào đây để đăng lời cho bài hát này,cach-mang
Người Chiến Sĩ Tàu Ngầm,"Nguyễn Thái Hiệp, Nguyễn Phi Hùng",người chiến sĩ tàu ngầm âm thầm giữa lòng đại dương mênh mông thề quyết giữ non sông yên bình từng con sóng biển đông người chiến sĩ tàu ngầm với lời thề vì non sông gầm vóc giữ trọn niềm tin vì quê hương yên bình xin dâng hiến tuổi xuân mình vì đất nước yêu thương nơi sâu thẳm trong lòng biển là tổ quốc thiêng liêng anh mang trong tim hồn thiêng nước việt du hiểm nguy chông gai quyết không lùi bước người chiến sĩ tàu ngầm cho non nước mãi vững bền mặc bão tố phong ba là những chiến công thầm lặng đẹp tựa muôn đóa hoa luôn ghi trong tim sắc son lời bác vì biển đảo giang sơn mãi luôn ngời sáng người chiến sĩ tàu ngầm,cach-mang
Ta Tự Hào Đi Lên,Quốc Hưng (NSƯT),ôi việt nam anh dũng những đoàn quân vượt lên bão táp đã trăm lần mang cả bốn ngàn năm vào trận thắng cho việt nam tươi sáng mãi những mùa xuân 1 ta đứng đầu ngọn sóng giữa dòng thời đại thác lũ cuộc đời ta đứng đầu ngọn sóng những luồng mạch tâm tư lay động loài người thác lũ cuộc đời thuyền ta bé nhỏ nhưng vững tay chèo không chòng chành nhắm thẳng hướng mà đi ta đứng đầu ngọn sóng nơi đấu tranh bão táp diệu kì nơi hy vọng những vườn hoa nở nơi chân lý sáng ngời đầu sóng gió ta tự hào đi lên ơi việt nam 2 đi giữa ngày hội lớn những ngày kỳ diệu chiến đấu trên tuyến đầu ta bước vào trận đánh với tâm hồn thanh xuân sôi sục tự hào như thác lũ tuôn trào nào ta lên đường vượt núi băng ngàn mang lời thề nhằm thẳng hướng tiền phương ta bước vào trận đánh nơi thét lên tiếng thét căm hờn nơi ta nhằm thẳng đầu thù mà bắn cho đất nước sáng ngời cờ chiến thắng ta tự hào đi lên ơi việt nam trùng trùng những đoàn quân vượt qua trường sơn băng qua thác lũ vượt qua thời gian tiến đánh tan bọn xâm lược ta ca khúc khải hoàn ơi việt nam muôn năm việt nam,cach-mang
Nhớ Nguyễn Du,Quốc Hưng (NSƯT), hiện chưa có lời bài hát nào cho nhớ nguyễn du do ca sĩ quốc hưng nsưt trình bày bạn có thể click vào đây để đăng lời cho bài hát này,cach-mang
Người Là Niềm Tin Tất Thắng,Quốc Hưng (NSƯT), hiện chưa có lời bài hát nào cho người là niềm tin tất thắng do ca sĩ quốc hưng nsưt trình bày bạn có thể click vào đây để đăng lời cho bài hát này,cach-mang
Cờ Đảng Sáng Mãi Vùng Biên,Trung Cao, hiện chưa có lời bài hát nào cho cờ đảng sáng mãi vùng biên do ca sĩ trung cao trình bày bạn có thể click vào đây để đăng lời cho bài hát này,cach-mang
Những Ánh Sao Đêm,Quốc Hưng (NSƯT), hiện chưa có lời bài hát nào cho những ánh sao đêm do ca sĩ quốc hưng nsưt trình bày bạn có thể click vào đây để đăng lời cho bài hát này,cach-mang
Bốn Mùa Trường Sa,Thụy Vân,ai đã nói trường sa không có mùa chỉ có nắng mưa và gió bão chưa đến đảo xa làm sao em hiểu nơi ấy bốn mùa ăm ắp yêu thương hà nội mùa này bằng lăng tím vấn vương bên phượng thắm hạ nồng nàn hương nắng đêm trường sa hoa bàng vuông cùng anh say ngắm mai xa rồi tay nắm chặt bàn tay em nhờ gió nhờ sóng và nhờ mây ấp ôm bốn mùa hiền hòa quanh đảo nhỏ như tình em gửi về anh đó những bão giông chỉ như sóng giận hờn mai xa rồi anh nhé mình yêu hơn từng tấc đảo quê hương bầu trời xanh xứ sở anh và em mãi chung tình yêu nhỏ đẫm trong tình yêu lớn trường sa,cach-mang
Bình Trị Thiên Khói Lửa,Nguyễn Vinh Sơn, hiện chưa có lời bài hát nào cho bình trị thiên khói lửa do ca sĩ nguyễn vinh sơn trình bày bạn có thể click vào đây để đăng lời cho bài hát này,cach-mang
Rạch Gầm Dậy Sóng,"Lạc Việt, Mắt Ngọc", hiện chưa có lời bài hát nào cho rạch gầm dậy sóng do ca sĩ lạc việt mắt ngọc trình bày bạn có thể click vào đây để đăng lời cho bài hát này,cach-mang
Tự Hào Thành Phố Của Tôi,V.A, hiện chưa có lời bài hát nào cho tự hào thành phố của tôi do ca sĩ va trình bày bạn có thể click vào đây để đăng lời cho bài hát này,cach-mang
Niềm Vui Thao Trường,Lạc Việt, hiện chưa có lời bài hát nào cho niềm vui thao trường do ca sĩ lạc việt trình bày bạn có thể click vào đây để đăng lời cho bài hát này,cach-mang
Lá Cờ Tổ Quốc Giữa Biển Đông,Quốc Hưng (NSƯT), hiện chưa có lời bài hát nào cho lá cờ tổ quốc giữa biển đông do ca sĩ quốc hưng nsưt trình bày bạn có thể click vào đây để đăng lời cho bài hát này,cach-mang
Tự Hào Nguyễn Văn Huyên,V.A, hiện chưa có lời bài hát nào cho tự hào nguyễn văn huyên do ca sĩ va trình bày bạn có thể click vào đây để đăng lời cho bài hát này,cach-mang
Thế Gian Này Chỉ Riêng Bác Mà Thôi,Trần Khánh (NSND), hiện chưa có lời bài hát nào cho thế gian này chỉ riêng bác mà thôi do ca sĩ trần khánh nsnd trình bày bạn có thể click vào đây để đăng lời cho bài hát này,cach-mang
Bác Hồ Về Quê Tôi Chống Hạn,Vân Anh, hiện chưa có lời bài hát nào cho bác hồ về quê tôi chống hạn do ca sĩ vân anh trình bày bạn có thể click vào đây để đăng lời cho bài hát này,cach-mang
Đường Chúng Ta Đi,Trần Ngọc Nguyên, hiện chưa có lời bài hát nào cho đường chúng ta đi do ca sĩ trần ngọc nguyên trình bày bạn có thể click vào đây để đăng lời cho bài hát này,cach-mang
Tiếng Hát Từ Thành Phố Mang Tên Người,Lạc Việt, hiện chưa có lời bài hát nào cho tiếng hát từ thành phố mang tên người do ca sĩ lạc việt trình bày bạn có thể click vào đây để đăng lời cho bài hát này,cach-mang
Bình Minh Của Lính Tàu Ngầm,"Lê Chí Hiếu, Thiên Phú", hiện chưa có lời bài hát nào cho bình minh của lính tàu ngầm do ca sĩ lê chí hiếu thiên phú trình bày bạn có thể click vào đây để đăng lời cho bài hát này,cach-mang
Đảo Là Nhà Tổ Quốc Của Chúng Ta,Quang Phúc, hiện chưa có lời bài hát nào cho đảo là nhà tổ quốc của chúng ta do ca sĩ quang phúc trình bày bạn có thể click vào đây để đăng lời cho bài hát này,cach-mang
Ru Mẹ,Mạnh Cường, hiện chưa có lời bài hát nào cho ru mẹ do ca sĩ mạnh cường trình bày bạn có thể click vào đây để đăng lời cho bài hát này,cach-mang
Giấc Mơ Dưới Gốc Cây Bồ Đề Nghĩa Trang Trường Sơn,Phan Thu, hiện chưa có lời bài hát nào cho giấc mơ dưới gốc cây bồ đề nghĩa trang trường sơn do ca sĩ phan thu trình bày bạn có thể click vào đây để đăng lời cho bài hát này,cach-mang
Miền Xa Thẳm,Hà Chi, hiện chưa có lời bài hát nào cho miền xa thẳm do ca sĩ hà chi trình bày bạn có thể click vào đây để đăng lời cho bài hát này,cach-mang
Người Lính Biên Phòng,Lạc Việt, hiện chưa có lời bài hát nào cho người lính biên phòng do ca sĩ lạc việt trình bày bạn có thể click vào đây để đăng lời cho bài hát này,cach-mang
Trung Đoàn 812,V.A, hiện chưa có lời bài hát nào cho trung đoàn 812 do ca sĩ va trình bày bạn có thể click vào đây để đăng lời cho bài hát này,cach-mang
Tự Nguyện,Thế Huy, hiện chưa có lời bài hát nào cho tự nguyện do ca sĩ thế huy trình bày bạn có thể click vào đây để đăng lời cho bài hát này,cach-mang
Đảng Là Cuộc Sống Của Tôi,Thế Huy, hiện chưa có lời bài hát nào cho đảng là cuộc sống của tôi do ca sĩ thế huy trình bày bạn có thể click vào đây để đăng lời cho bài hát này,cach-mang
Người Thầy Giáo Mang Quân Hàm Xanh,Lạc Việt, hiện chưa có lời bài hát nào cho người thầy giáo mang quân hàm xanh do ca sĩ lạc việt trình bày bạn có thể click vào đây để đăng lời cho bài hát này,cach-mang
Đồng Đội Của Tôi,Vũ Tiến Lâm (NSƯT), hiện chưa có lời bài hát nào cho đồng đội của tôi do ca sĩ vũ tiến lâm nsưt trình bày bạn có thể click vào đây để đăng lời cho bài hát này,cach-mang
Người Chiến Sĩ Ấy,Vũ Tiến Lâm (NSƯT), hiện chưa có lời bài hát nào cho người chiến sĩ ấy do ca sĩ vũ tiến lâm nsưt trình bày bạn có thể click vào đây để đăng lời cho bài hát này,cach-mang
Dấu Chân Phía Trước,Vũ Tiến Lâm (NSƯT), hiện chưa có lời bài hát nào cho dấu chân phía trước do ca sĩ vũ tiến lâm nsưt trình bày bạn có thể click vào đây để đăng lời cho bài hát này,cach-mang
Mẹ Việt Nam Anh Hùng,Lạc Việt, hiện chưa có lời bài hát nào cho mẹ việt nam anh hùng do ca sĩ lạc việt trình bày bạn có thể click vào đây để đăng lời cho bài hát này,cach-mang
Mỹ Thành Quê Tôi,Trần Hồng Nhung, hiện chưa có lời bài hát nào cho mỹ thành quê tôi do ca sĩ trần hồng nhung trình bày bạn có thể click vào đây để đăng lời cho bài hát này,cach-mang
Nơi Đảo Xa,V.A, hiện chưa có lời bài hát nào cho nơi đảo xa do ca sĩ va trình bày bạn có thể click vào đây để đăng lời cho bài hát này,cach-mang
Đêm Ba Mươi Của Mẹ,Công Quang, hiện chưa có lời bài hát nào cho đêm ba mươi của mẹ do ca sĩ công quang trình bày bạn có thể click vào đây để đăng lời cho bài hát này,cach-mang
Mồ Hôi Đá,Huy Hoàng, hiện chưa có lời bài hát nào cho mồ hôi đá do ca sĩ huy hoàng trình bày bạn có thể click vào đây để đăng lời cho bài hát này,cach-mang
Nắng Ấm Về Trên Tổ Quốc,V.A, hiện chưa có lời bài hát nào cho nắng ấm về trên tổ quốc do ca sĩ va trình bày bạn có thể click vào đây để đăng lời cho bài hát này,cach-mang
Hát Về Anh Người Con Trung Hiếu,Đinh Xuân Hội, hiện chưa có lời bài hát nào cho hát về anh người con trung hiếu do ca sĩ đinh xuân hội trình bày bạn có thể click vào đây để đăng lời cho bài hát này,cach-mang
Đồng Đội,V.A, hiện chưa có lời bài hát nào cho đồng đội do ca sĩ va trình bày bạn có thể click vào đây để đăng lời cho bài hát này,cach-mang
Tây Ninh Rực Lửa Chiến Công,Lạc Việt, hiện chưa có lời bài hát nào cho tây ninh rực lửa chiến công do ca sĩ lạc việt trình bày bạn có thể click vào đây để đăng lời cho bài hát này,cach-mang
Trong Lòng Đồng Bào,CLB Ngôi Sao Trẻ, hiện chưa có lời bài hát nào cho trong lòng đồng bào do ca sĩ clb ngôi sao trẻ trình bày bạn có thể click vào đây để đăng lời cho bài hát này,cach-mang
Trên Bến Đò Biên Giới,V.A, hiện chưa có lời bài hát nào cho trên bến đò biên giới do ca sĩ va trình bày bạn có thể click vào đây để đăng lời cho bài hát này,cach-mang
Theo Chân Người Thợ Thành Đồng,Tốp Ca, hiện chưa có lời bài hát nào cho theo chân người thợ thành đồng do ca sĩ tốp ca trình bày bạn có thể click vào đây để đăng lời cho bài hát này,cach-mang
Nỗi Nhớ Tây Ninh,Bích Hảo, hiện chưa có lời bài hát nào cho nỗi nhớ tây ninh do ca sĩ bích hảo trình bày bạn có thể click vào đây để đăng lời cho bài hát này,cach-mang
Ca Ngợi Tổ Quốc,Tốp Ca Nam Nữ K46, hiện chưa có lời bài hát nào cho ca ngợi tổ quốc do ca sĩ tốp ca nam nữ k46 trình bày bạn có thể click vào đây để đăng lời cho bài hát này,cach-mang
Tuyên Quang Rạng Rỡ Non Ngàn,V.A, hiện chưa có lời bài hát nào cho tuyên quang rạng rỡ non ngàn do ca sĩ va trình bày bạn có thể click vào đây để đăng lời cho bài hát này,cach-mang
Màu Áo Công An,Phan Nhã Ca, hiện chưa có lời bài hát nào cho màu áo công an do ca sĩ phan nhã ca trình bày bạn có thể click vào đây để đăng lời cho bài hát này,cach-mang
Hành Khúc Hậu Cần QK2,V.A, hiện chưa có lời bài hát nào cho hành khúc hậu cần qk2 do ca sĩ va trình bày bạn có thể click vào đây để đăng lời cho bài hát này,cach-mang
Bài Ca Hậu Cần QK2,V.A, hiện chưa có lời bài hát nào cho bài ca hậu cần qk2 do ca sĩ va trình bày bạn có thể click vào đây để đăng lời cho bài hát này,cach-mang
Biên Cương Trong Trái Tim Người Lính,V.A, hiện chưa có lời bài hát nào cho biên cương trong trái tim người lính do ca sĩ va trình bày bạn có thể click vào đây để đăng lời cho bài hát này,cach-mang
Cảm Xúc Tháng Mười,Bùi Thắng,không thể nói trời không trong hơn và mắt em xanh khác ngày thường khi đoàn quân kéo về mùa thu ấy nhịp trống rung ba mươi sáu phố phường mẹ đứng hàng đầu rưng rưng nước mắt xốn xang mẹ thầm gọi các con anh chiến sĩ mến thương nhìn mẹ nghe niềm vui ấm cả tâm hồn đêm cái đêm rút qua gầm cầu anh anh đã hẹn ngày mai trở lại sóng sông hồng vỗ bờ hát mãi đỏ niềm tin là khúc khải hoàn ca không thể nói trời không xanh hơn và mắt em xanh khác ngày thường khi đoàn quân kéo về mùa thu ấy nhịp trống rung ba mươi sáu phố phường một sớm thu trong đất thắm sao vàng năm cửa ô xòe năm cánh rộng đoàn quân về nhấp nhô như sóng những ngôi nhà đường muốn cao thêm tháng mười ấy là khúc ca xanh khúc ca mở những chiến công đầy ôi thăng long đông đô hà nội nghìn năm vẫn một trái tim này,cach-mang
Vẫn Còn Gặp Nhau,Huy Hoàng, hiện chưa có lời bài hát nào cho vẫn còn gặp nhau do ca sĩ huy hoàng trình bày bạn có thể click vào đây để đăng lời cho bài hát này,cach-mang
Quốc Ca,V.A, hiện chưa có lời bài hát nào cho quốc ca do ca sĩ va trình bày bạn có thể click vào đây để đăng lời cho bài hát này,cach-mang
Tình Ca,Mạnh Cường, hiện chưa có lời bài hát nào cho tình ca do ca sĩ mạnh cường trình bày bạn có thể click vào đây để đăng lời cho bài hát này,cach-mang
Đảo Đá Trường Sa,Công Quang, hiện chưa có lời bài hát nào cho đảo đá trường sa do ca sĩ công quang trình bày bạn có thể click vào đây để đăng lời cho bài hát này,cach-mang
Tổ Quốc Gọi Tên Mình,Hữu Trung, hiện chưa có lời bài hát nào cho tổ quốc gọi tên mình do ca sĩ hữu trung trình bày bạn có thể click vào đây để đăng lời cho bài hát này,cach-mang
Chí Sĩ Trần Cao Vân,V.A, hiện chưa có lời bài hát nào cho chí sĩ trần cao vân do ca sĩ va trình bày bạn có thể click vào đây để đăng lời cho bài hát này,cach-mang
Màu Hoa Đỏ,Nguyễn Anh Sơn, hiện chưa có lời bài hát nào cho màu hoa đỏ do ca sĩ nguyễn anh sơn trình bày bạn có thể click vào đây để đăng lời cho bài hát này,cach-mang
Lính Hát,V.A, hiện chưa có lời bài hát nào cho lính hát do ca sĩ va trình bày bạn có thể click vào đây để đăng lời cho bài hát này,cach-mang
Đảng Đã Cho Ta Sáng Mắt Sáng Lòng,Phi Hùng, hiện chưa có lời bài hát nào cho đảng đã cho ta sáng mắt sáng lòng do ca sĩ phi hùng trình bày bạn có thể click vào đây để đăng lời cho bài hát này,cach-mang
Qua Miền Tây Bắc,V.A, hiện chưa có lời bài hát nào cho qua miền tây bắc do ca sĩ va trình bày bạn có thể click vào đây để đăng lời cho bài hát này,cach-mang
Tổ Quốc Ta Cờ Bay,Thăng Long Band, hiện chưa có lời bài hát nào cho tổ quốc ta cờ bay do ca sĩ thăng long band trình bày bạn có thể click vào đây để đăng lời cho bài hát này,cach-mang
Xin Hãy Đừng Quên,Hoàng Thiện, hiện chưa có lời bài hát nào cho xin hãy đừng quên do ca sĩ hoàng thiện trình bày bạn có thể click vào đây để đăng lời cho bài hát này,cach-mang
Các Anh Nhận Được Chưa,Cảnh Tình, hiện chưa có lời bài hát nào cho các anh nhận được chưa do ca sĩ cảnh tình trình bày bạn có thể click vào đây để đăng lời cho bài hát này,cach-mang
Tự Nguyện,Thăng Long Band, hiện chưa có lời bài hát nào cho tự nguyện do ca sĩ thăng long band trình bày bạn có thể click vào đây để đăng lời cho bài hát này,cach-mang
