title,singer,lyric,genre
Tiếng Hát Giữa Rừng Pác Bó,"Đặng Hồng Nhung, Ngọc Mai", hiện chưa có lời bài hát nào cho tiếng hát giữa rừng pác bó do ca sĩ đặng hồng nhung ngọc mai trình bày bạn có thể click vào đây để đăng lời cho bài hát này,cach-mang
Tàu Anh Qua Núi (Cover),Nguyễn Phương Hằng,đi dọc việt nam theo bánh con tàu quay qua đèo hải vân mây bay đỉnh núi nhớ khi xưa qua đèo qua suối mà lòng ta mơ tàu qua núi cao ngày hôm nay thênh thang con đường lớn tàu anh đi trong yêu thương chào đón xao xuyến bao niềm vui theo bánh con tàu đi là thương nhau cho con tàu anh tới là yêu nhau mấy suối em cũng lội là yêu nhau mấy núi em cũng trèo con tàu việt nam đi suốt bốn mùa xuân qua đèo hải vân mây bay đỉnh núi nhớ thương nhau em chờ anh tới mà tàu anh đi vượt qua núi cao trời quê hương trong xanh như lời hát biển quê hương ru êm êm bờ cát đưa chúng ta cùng đi ra bắc hay về nam là thương nhau em bắc cầu cho tàu anh tới là yêu nhau mấy suối em cũng lội là yêu nhau mấy núi em cũng trèo,cach-mang
Tổ Quốc Gọi Tên Mình,Đàm Vĩnh Hưng,tôi đang nghe tổ quốc gọi tên mình bằng tiếng sóng trường sa hoàng sa dội vào ghềnh đá tiếng tổ quốc vọng về từ biển cả bão tố sập sờn chăng lưới bủa vây tôi đang nghe tổ quốc gọi tên mình bằng tiếng sóng trường sa hoàng sa dội vào ghềnh đá sóng cuồn cuộn lên dáng hình đất nước một tấc biển cắt rời vạn tấc đất đớn đau tổ quốc của tôi tổ quốc của tôi mấy ngàn năm chưa bao giờ ngơi nghỉ ngọn đuốc hòa bình bao người đã ngã máu của người nhuộm mặn sóng biển đông tổ quốc linh thiêng tổ quốc linh thiêng ngọn đuốc hòa bình trên tay rực lửa biết bao triệu mỗi người thao thức tiếng việt nam biết bao triệu người lấy thân mình che chở tổ quốc linh thiêng tổ quốc linh thiêng ngọn đuốc hòa bình trên tay rực lửa tôi lắng nghe tôi lắng nghe tôi lắng nghe tổ quốc gọi tên mình,cach-mang
Hành Khúc Bình Yên,Minh Quang,nếu nhắc về tôi xin giữ bình yên nếu nhắc về tôi xin hát bài ca đồng đội tôi chiếc xe màu lửa đồng đội tôi màu áo xanh than đồng đội tôi là tiếng còi thôi thúc cùng tiếng trái tim thúc dục êm đềm nơi tôi đến biết bao người trông đợi dập tắt buồn đau mang trọn thanh bình dù sạm đen tóc bết lấm tro tàn khi tình yêu nhuộm xanh lên màu áo và chỉ khi bình yên tôi trở về vì bình yên khoác lên màu áo vì bình yên chẳng nghĩ gian nan vì bình yên là tiếng lòng thôi thúc thề quyết xông pha giữ trọn thanh bình,cach-mang
Em Là Hoa Pơ Lang (Live),Võ Hạ Trâm, hiện chưa có lời bài hát nào cho em là hoa pơ lang live do ca sĩ võ hạ trâm trình bày bạn có thể click vào đây để đăng lời cho bài hát này,cach-mang
Nơi Ấy Là Trường Sa,Huy Vĩnh, hiện chưa có lời bài hát nào cho nơi ấy là trường sa do ca sĩ huy vĩnh trình bày bạn có thể click vào đây để đăng lời cho bài hát này,cach-mang
Hành Trang Của Người Lính Đảo,Hiếu Thành,ngày xưa mẹ tiễn con ra khơi ra khơi bám biển hành trang mẹ trao là khúc dân ca thiết tha hình bóng quê nhà khao lề thế lính cha ra đi không hẹn ngày về khao lề thế lính cha mang theo nỗi nhớ tình quê ngày nay mẹ tiễn con ra khơi ra khơi bám biển hành trang mẹ trao vẫn khúc dân ca thiết tha hình bóng quê nhà hoàng sa trường sa thấm bao đời xương máu ông cha hoàng sa trường sa nâng niu từng khúc hát quê hương khao lề thế lính câu dân ca theo con sóng vào bờ khao lề thế lính bao hy sinh gìn giữ cho muôn đời sau hoàng sa trường sa nay cháu con thề quyết xông pha hoàng sa trường sa cờ đỏ sao vàng hồn nước vọng về từ biển đông,cach-mang
Chiều Biên Giới,"Lam Hoa, Bùi Thắng", hiện chưa có lời bài hát nào cho chiều biên giới do ca sĩ lam hoa bùi thắng trình bày bạn có thể click vào đây để đăng lời cho bài hát này,cach-mang
Mùa Xuân Âm Vang Thần Tốc,Tốp Ca, hiện chưa có lời bài hát nào cho mùa xuân âm vang thần tốc do ca sĩ tốp ca trình bày bạn có thể click vào đây để đăng lời cho bài hát này,cach-mang
Thúc Quân,Vô Danh Thị, hiện chưa có lời bài hát nào cho thúc quân do ca sĩ vô danh thị trình bày bạn có thể click vào đây để đăng lời cho bài hát này,cach-mang
Khúc Quân Hành Ngành Y Chống Dịch,"Xuân Hảo, Tốp Ca",nào bạn ơi nào bạn ơi nào bạn ơi những chiến sỹ ngành y ở nơi đâu đại dịch tràn qua ở nơi đâu có người nhiễm bệnh ở nơi đâu tính mạng người bị đe dọa ở nơi đó ở nơi đó cần chiến sỹ ngành y là lạ la là là la là là la la la la là la bất chấp hiểm nguy lây lan dịch bệnh bất chấp nóng bức ngột ngạt khó khăn mang theo lời bác chúng ta lên đường mang theo yêu thương chúng ta vào trận nào bạn ơi nào bạn ơi nào bạn ơi những chiến sỹ ngành y xin hãy viết lên ngực mình dòng tên viết vào đại dịch chiến thắng không quên viết vào cuộc đời trách nhiệm tình người viết vào lịch sử những trang vàng ngành y việt nam là lạ la là là la là là la la la la là la nào bạn ơi nào bạn ơi nào bạn ơi những chiến sỹ ngành y cùng vào trận quyết thắng corona cùng đồng lòng chiến thắng corona,cach-mang
Khúc Quân Hành Người Chiến Sĩ,Đoàn Nghệ thuật Quân Khu 4,cùng hát khúc quân hành sao vàng lấp lánh vững bước thêm tự hào lời bác khắc ghi trong tim ươm mầm tài năng vì tương lai đất nước dù có những thăng trầm vất vả gian nan vẫn quyết tâm luyện rèn người chiến sĩ nghệ sĩ hăng say dâng trọn tình yêu đến cho cuộc đời mang muôn lời ca điệu múa ra thao trường mang khúc nhạc vui biên giới hải đảo xa xôi yêu sao đồng đội ơi ngày tháng ta bên nhau cùng hát khúc ca về mái trường thân yêu đẹp mãi nơi bao tài năng tung cánh bay muôn phương nơi trao niềm tin thắp sáng cho bao ước mơ công ơn thầy cô ghi nhớ những tháng ngày cùng hát khúc quân hành mái trường tương lai ngời sáng mùa thu nắng sân trường bên bạn bè vui nhớ biết bao kỷ niệm người chiến sĩ nghệ sĩ hôm nay vững vàng niềm tin hát khúc quân hành,cach-mang
Bài Ca Người Thanh Niên Tình Nguyện Chống Dịch,Đức Chiến,từ muôn nơi chúng tôi là thanh niên tình nguyện theo lời đảng cùng toàn quân và nhân dân ta chung tay đẩy lùi covid đại dịch corona nơi đâu cần nơi đâu khó có chúng tôi người thanh niên tình nguyện chống dịch ta không quản đi sớm về khuya đây mặt trận chống dịch là nhà xem bệnh nhân là người thân ta quyết chí đồng lòng nở nụ cười trên môi vì cuộc sống tươi vui bao em thơ bao mẹ già vơi đi nỗi lo và đất nước trở lại yên lành ấm êm tự hào thay người thanh niên tình nguyện chống dịch ta ngân vang lên mãi bản hùng ca ta yêu sao đất nước nở hoa,cach-mang
Những Chiến Sĩ Áo Trắng,Minh Quang,cho tôi gọi em là chiến sĩ tuy chẳng đạn bom chẳng chiến trường nguy kịch nhưng áo trắng vào tâm dịch xa gia đình lo cho đất nước bình yên cho tôi gọi em là chiến sĩ những chiến binh áo trắng mẹ hiền màn đêm xuống buông không gian tĩnh lặng em đã góp phần thắp lửa trái tim góp sức mình khi tổ quốc lâm nguy ơ người chiến sĩ áo trắng đẹp sao em vẫn miệt mài trán lấm tấm mồ hôi ơ em đã ra đi tới mọi miền đất nước nơi tâm dịch thành phố hồ chí minh để được phần diệt trừ dịch bệnh để mọi người dân có cuộc sống yên bình những chiến sĩ từng chinh chiến đất miền trung nay chia lửa cùng miền nam dập dịch thành phố còn cách ly trong mùa chống dịch,cach-mang
Tiếng Chày Trên Sóc Bom Bo,"Hương Ly, Hồng Nhung (Dân Ca), Hồng Lụa", hiện chưa có lời bài hát nào cho tiếng chày trên sóc bom bo do ca sĩ hương ly hồng nhung dân ca hồng lụa trình bày bạn có thể click vào đây để đăng lời cho bài hát này,cach-mang
Việt Nam Ơi! Tiếng Gọi Thiêng Liêng,V.A, hiện chưa có lời bài hát nào cho việt nam ơi tiếng gọi thiêng liêng do ca sĩ va trình bày bạn có thể click vào đây để đăng lời cho bài hát này,cach-mang
Có Tuổi 20 Thành Sóng Nước,Huyền Trang,đò lên thạch hãn ơichèo nhẹ đáy sông còn đó bạn tôi nằm vỗ yên bờ mãi mãi ngàn năm thạch hãn ơi một dòng sông xanh trong thao thiết một dòng sông da diết giọng hò một dòng sông tình nghĩa chứa chan một dòng sông bi tráng hào hùng ơi thạch hãn ơi đò lên thạch hãn ơichèo nhẹ đáy sông còn đó bạn tôi nằm ơ hờ hờ hơ có biết bao nhiêu biết bao nhiêu ở dưới đáy sông những tuổi 20 anh hùng đang nằm lại dưới đáy sông tuổi 20 đã thành sóng nước nên linh thiêng thạch hãn đến vô cùng tuổi 20 đã thành sóng nước nên linh thiêng quảng trị đất kiên cường ơi hò là hò ơi từ nơi nơi lớp lớp về đây đèn hoa đăng rực sáng mang những tri ân từ muôn vạn con người đang sống hôm nay có tuổi 20 thành sóng nước vỗ yên bờ mãi mãi ngàn năm đất nước mình ân nghĩa mãi ngàn năm còn mãi ngàn năm ,cach-mang
Covid Ắt Diệt Vong,Đoàn Nghệ thuật Quân Khu 4, hiện chưa có lời bài hát nào cho covid ắt diệt vong do ca sĩ đoàn nghệ thuật quân khu 4 trình bày bạn có thể click vào đây để đăng lời cho bài hát này,cach-mang
Nắng Ấm Về Trên Tổ Quốc,Khuất Duy Hà Nội,núi sông ơi nắng lên ấm đẹp bốn mùa màu lá xanh tươi ngàn hoa hé môi mỉm cười nước non ta tuổi xuân đã nở khắp trời đồng lúa xanh tươi chào đón nắng xuân về rồi ánh nắng mới thay áo tổ quốc từng ngày tung cánh rộng chim đại bàng đang xóa màu tang chiến tranh ngàn triệu người tha thiết yêu đời mới tha thiết yêu tổ quốc nguyện đem trọn dòng máu nóng hiến dâng núi sông ơi đắm say ánh mặt trời sưởi ấm quê hương lời hát mến yêu muôn đời tiếng ai ru đón em bé vừa ra đời bầu sữa trên môi mẹ ôm bé yêu trìu mến đứng bên nôi nhìn môi bé đẹp hé cười tưởng tới tương lai của đất nước bao đẹp tươi đất nước mới phơi những mỏ than ngoài trời ống khói mọc cao vời vợi thác nước mừng điện sáng soi tôi ca lên tiếng hát yêu đời mới tặng cho bao người thân mến cùng tôi xây dựng tổ quốc mến yêu núi sông ơi đắm say ánh mặt trời sưởi ấm quê hương lời hát ngời sáng muôn đời,cach-mang
Tự Hào Hai Tiếng Việt Nam,Lê Xuân Hảo, hiện chưa có lời bài hát nào cho tự hào hai tiếng việt nam do ca sĩ lê xuân hảo trình bày bạn có thể click vào đây để đăng lời cho bài hát này,cach-mang
Hào Hùng Bạch Đằng Giang,"Tùng Dương, Tốp Ca",chuyện xưa chuyện xưa giặc dữ phương bắc chất chứa dã tâm thuyền chiến vạn ngàn tướng quân trùng điệp tràn qua như nước tàn ác vô biên nhằm cửa bạch đằng xông vào xâm lược xâm lược nước ta á à a á a quân thù đâu biết nhân dân nước việt tài trí vô biên dũng cảm vô song bạch đằng cửa sông bạch đằng tử huyệt bạch đằng nước việt đây là đất thiêng bạch đằng cửa sông bạch đằng tử huyệt bạch đằng nước việt đây là đất thiêng biển này là của ta sông này là của ta triều dâng xóa vết bẫy đã giăng rồi cọc nhọn nơi nơi đâm thủng thuyền giặc giặc bị đánh tan ba lần giặc tan trên sóng bạch đằng a à á a à bạch đằng cửa sông bạch đằng tử huyệt ba lần hóa kiếp quân thù xâm lăng bạch đằng cửa sông bạch đằng tử huyệt quân thù tan tác đất càng thêm thiêng à a á a a à a á a a ngày nay về đây bạch đằng giang ơi sông nặng phù sa chan chứa hồn thiêng ôn lại tích xưa nhớ lại tích xưa bạch đằng giang đây muôn vạn hào hùng hơ ơ hớ ớ hào hùng,cach-mang
Đường Lên Phía Trước,V.A, hiện chưa có lời bài hát nào cho đường lên phía trước do ca sĩ va trình bày bạn có thể click vào đây để đăng lời cho bài hát này,cach-mang
Tàu Anh Qua Núi,V.A, hiện chưa có lời bài hát nào cho tàu anh qua núi do ca sĩ va trình bày bạn có thể click vào đây để đăng lời cho bài hát này,cach-mang
Lá Cờ Đảng,Khuất Duy Hà Nội,đất nước bốn ngàn năm ôi tự hào biết mấy hạnh phúc trong tay ta đang nở hoa kết trái còn gì đẹp hơn còn gì đẹp hơn lá cờ đỏ búa liềm đảng ta đó hân hoan một niềm tin trong đêm đen lá cờ của đảng rạng roi đường đấu tranh thắm máu đào cờ đảng hồng tươi sắc thắm máu hy sinh với dân giữ vẹn trọn chữ hiếu với đảng giữ trọn lòng tin yêu cờ đảng gọi ta đi tới đắp xây nước non đẹp tươi bao vinh quang lá cờ của đảng rạng roi đường đấu tranh dưới bóng cờ lòng tràn niềm tin chân lý sáng trong tim với dân giữ vẹn trọn chữ hiếu với đảng giữ trọn lòng tin yêu trọn đời lòng ta gắn bó sắc son tin theo bóng cờ,cach-mang
Mộ Gió Hùng Binh,Thanh Pháp,đến lý sơn gặp ngôi mộ gió bờ cạnh miết mòn bao mùa bao mùa cát bay rụng rã kính cẩn hùng binh xói buốt cõi lòng ngày ấy ra đi gian khổ hãi hùng bão tố giăng mắc hiểm nguy muôn triệu à ơi ơi à à à ơi à ơi tấm thân hùng binh bó tròn đôi chiếu tình quê hương mây chằng néo đòn tre dẫu thẻ bài có ghi phiên hiệu nhưng biển quá mênh mông có dễ đâu tìm được lối về không dễ đâu không dễ đâu tìm được lối về à ơi à ơi à à ơi à à ơi mẹ già chờ con nơi đó đảo quê tốc tác gió bao trụt trồi trụt trồi sóng biển vì tổ quốc ôi vì tổ quốc người hùng binh dâng hiến tấm thân mình những tấm thân mình nơi chốn biển khơi mộ gió dựng lên ghi nhớ những con người để cho nỗi buồn của mẹ đặng nhẹ vơi à ơi à ới à à ơi à ới à biển khơi ơi biển khơi ơi cứ gọi réo ngàn đời vị quốc vong thân vì nước quên mình ân tình biết bao mộ gió cho những hùng binh,cach-mang
Tượng Đài Chiến Thắng,Khuất Duy Hà Nội,giữa núi rừng ngày ấy 30 tư chiến sỹ 30 tư nụ cười nhưng chung một ý chí sắt thép bền gan dẫu hy sinh xá chi gió rét mưa rừng đạn bom gian khổ sao ngăn được lòng ta khao khát tự do từng đoàn người ra đi không hẹn ngày về những đêm băng rừng vượt núi đất mẹ chở che cho ta chở che cho những người con đất việt không chịu cúi đầu trước giặc ngoại xâm một điện biên năm ấy một trường sơn ngày ấy là tráng ca lừng lẫy nối đất nước 2 miền 1 tiếng việt nam là tiếng thân yêu trên mỗi người chiến sỹ là máu xương bao nhiêu anh hùng đắp lên sừng sững hiên ngang dưới quân kỳ quyết thắng nguyện trái tim đây mãi theo nhịp tiến quân đường lên phía trước tượng đài chiến thắng cùng nhau đi tới vinh quang,cach-mang
Những Ánh Sao Đêm,Hoàng Lang, hiện chưa có lời bài hát nào cho những ánh sao đêm do ca sĩ hoàng lang trình bày bạn có thể click vào đây để đăng lời cho bài hát này,cach-mang
Hành Trình Vì Biển Đảo Quê Hương,CLB Ngôi Sao Trẻ, hiện chưa có lời bài hát nào cho hành trình vì biển đảo quê hương do ca sĩ clb ngôi sao trẻ trình bày bạn có thể click vào đây để đăng lời cho bài hát này,cach-mang
Niềm Tin Dâng Đảng,Vũ Thắng Lợi, hiện chưa có lời bài hát nào cho niềm tin dâng đảng do ca sĩ vũ thắng lợi trình bày bạn có thể click vào đây để đăng lời cho bài hát này,cach-mang
Thanh Niên Quận 8 Viết Tiếp Bản Hùng Ca,CLB Ngôi Sao Trẻ, hiện chưa có lời bài hát nào cho thanh niên quận 8 viết tiếp bản hùng ca do ca sĩ clb ngôi sao trẻ trình bày bạn có thể click vào đây để đăng lời cho bài hát này,cach-mang
Chiến Sĩ Hành Quân Xanh,Black Eyes, hiện chưa có lời bài hát nào cho chiến sĩ hành quân xanh do ca sĩ black eyes trình bày bạn có thể click vào đây để đăng lời cho bài hát này,cach-mang
Mùa Xuân,Dương Đức, hiện chưa có lời bài hát nào cho mùa xuân do ca sĩ dương đức trình bày bạn có thể click vào đây để đăng lời cho bài hát này,cach-mang
"Vinh Quang, Ơi Việt Nam",Tốp Ca,là la lá lá la la lá lá la là là la lá lá la la lá lá la là đoàn kết một lòng ta làm nên chiến công trí tuệ kiên cường ta vượt qua bão dông truyền thống anh hùng ta làm nên chiến thắng bao chiến thắng ngoại xâm lẫy lừng việt nam nay vững mạnh đi lên muôn đường xa việt nam ta nên bản hùng ca vang xa vang xa tự hào tổ quốc ta vinh quang ơi việt nam tự hào tổ quốc ta vinh quang ơi việt nam tự hào tổ quốc ta vinh quang ơi việt nam,cach-mang
Đất Nước Trọn Niềm Vui,Lê Văn Lộc, hiện chưa có lời bài hát nào cho đất nước trọn niềm vui do ca sĩ lê văn lộc trình bày bạn có thể click vào đây để đăng lời cho bài hát này,cach-mang
Chào Em Cô Gái Lam Hồng,Trung Quang,xe ta bon trên những đường giữa làng quê ta băng qua bao suối đèo đồi nương mà xe ta bon ra chiến trường chào em cô gái lam hồng giữa tiếng bom gào đạn dội vẫn nghe vang vang câu hò trên đường niềm vui lớn tỏa lan trên quê ta đi thông đường để những chuyến xe ta băng băng qua hồng lĩnh ơi đỉnh cao mây vờn đã cùng em từ những đêm thức trọn nối tiếp những mạch đường quê nhà đường rộn ràng những chuyến xe qua tình nghĩa quê em sáng tỏ như ánh trăng đêm rằm tiền phương tay lái mang tình em đảm đang xe ta bon bon đi trên đường lòng vui như mở hội đường quê em êm êm đưa như thoi dệt bao tâm tình lững lờ đèn giặc dõi lửa soi để em đi thông đường kìa gà rừng vẳng gáy cuối nương vượt đèo ngang nào bạn ơi tay lái ta dồn lên lời ca hỡi cô gái trên đất lam hồng mỗi xe qua lòng em thấu tỏ dù xe anh chạy đêm chạy ngày cũng chẳng bằng tình nghĩa em vì miền nam bao yêu thương đi thông đường để những chuyến xe qua hòa chung tay lái em đã góp công ngày đêm trên tuyến đường hoành sơn một mái xuôi về hòa tình em từ những viên đá nhỏ đêm đêm lát trên đường quê nhà đường rộn ràng những chuyến xe qua tình nghĩa quê em sáng tỏ như ánh trăng đêm rằm tiền phương tay lái mang tình em đảm đang xe ta bon bon đi trên đường tiền phương đang vẫy gọi về quê hương bao thân yêu cho ta gửi lời thâm tình chào những người chẳng tiếc máu xương ngày đêm đi thông đường là nhiễu điều phủ lấy giá gương đây tình nam với nghĩa bắc thương nhau ta nào có quản chi hỡi cô gái trên đất lam hồng với bàn tay em dời non và lấp biển dù xe anh chạy đêm chạy ngày cũng chẳng bằng tình nghĩa em băng mình trong bao gian nan đi thông đường để những chuyến xe qua dồn nhanh tay lái vút tiếng hát ca chào quê em lam hồng,cach-mang
Đất Nước Tình Yêu,V.A, hiện chưa có lời bài hát nào cho đất nước tình yêu do ca sĩ va trình bày bạn có thể click vào đây để đăng lời cho bài hát này,cach-mang
Ca Ngợi Hồ Chủ Tịch,Huy Vĩnh, hiện chưa có lời bài hát nào cho ca ngợi hồ chủ tịch do ca sĩ huy vĩnh trình bày bạn có thể click vào đây để đăng lời cho bài hát này,cach-mang
Đường Chúng Ta Đi (Live),Võ Minh Trí, hiện chưa có lời bài hát nào cho đường chúng ta đi live do ca sĩ võ minh trí trình bày bạn có thể click vào đây để đăng lời cho bài hát này,cach-mang
Huyền Thoại Thiếu Niên,"Dương Đức, Phương Diệp", hiện chưa có lời bài hát nào cho huyền thoại thiếu niên do ca sĩ dương đức phương diệp trình bày bạn có thể click vào đây để đăng lời cho bài hát này,cach-mang
Việt Nam Hào Hùng,Lâm Chấn Huy,từ thời lập quốc biết bao minh quân yêu nước đánh đuổi ngoại xâm giữ gìn tấc đất quê hương bảo vệ trường sa hoàng sa đất liền biển đảo chủ quyền việt nam thuộc về con rồng cháu tiên việt nam non nước thiêng liêng vì yêu non sông việt nam độc lập phương bắc vì yêu quê hương thắng pháp nhật mỹ đầu hàng bảo vệ việt nam hàng triệu con người nằm xuống hòa bình độc lập chung vai phát triển giang san việt nam bất khuất hiên ngang ôi dòng máu rồng tiên đượm hồng trong mỗi trái tim ôi giang sơn hữu tình giữ gìn non nước ba miền ôi người việt năm châu bảo vệ chủ quyền việt nam việt nam dựng xây thế giới nhân quyền công lý hòa bình ôi đất nước việt nam anh dũng và hiên ngang ôi việt nam thiêng liêng ôi việt nam muôn năm việt nam hào hùng bất khuất trên mọi chiến trường việt nam độc lập tự do hạnh phúc vinh quang việt nam hòa bình thân thiện nghĩa tình hợp tác tổ quốc việt nam tự hào hai chữ việt nam việt nam giàu đẹp non sông,cach-mang
Bình Dương,Thị Trấn Trong Tôi, hiện chưa có lời bài hát nào cho bình dương thị trấn trong tôi do ca sĩ nguyễn trung tín trình bày bạn có thể click vào đây để đăng lời cho bài hát này,cach-mang
Đường Trường Sơn Xe Anh Qua,Lương Nguyệt Anh, hiện chưa có lời bài hát nào cho đường trường sơn xe anh qua do ca sĩ lương nguyệt anh trình bày bạn có thể click vào đây để đăng lời cho bài hát này,cach-mang
Đêm Nghe Hát Đò Đưa Nhớ Bác,Lê Mận,một khúc dân ca sâu lắng quê nhà đêm sông lam dạt dào sóng nước vọng câu đò đưa tình người mộc mạc bát ngát nhớ thương mà thoảng hương giữa đời đêm trăng lên nghe tiếng đò đưa ngân rất gần nhớ chuyện người thời xa xưa bác lớn lên trên quê đất mẹ hiền bác theo phường đi nghe hát quần xắn gối đứng đầu sân dân mất nước mới lầm than mà nên lời ca nghe càng xót xa tuổi ấu thơ bác đã đi suốt chiều dài câu đò đưa tuổi ấu thơ bác đã sống suốt chiều rộng câu dân ca đêm kim liên ấm áp ngày xưa hay hát phường ấy ngày hội những danh nhân đất nước đau thương nên đến luận bàn bác theo phường đi nghe hát trăng đứng bóng trăng tà thôi bao thơ hay gỡ tơ rối mà trước cuộc đời đành bó tay tuổi ấu thơ bác đã đi suốt chiều dài câu đò đưa tuổi ấu thơ bác đã sống suốt chiều rộng câu dân ca rồi từ ấy ơ bác tìm đường cứu nước non một khúc dân ca sâu lắng ơ quê nhà đêm sông lam dạt dào sóng nước ơ vọng câu đò đưa tình người mộc mạc bát ngát nhớ thương mà thoảng hương giữa đời đêm quê hương nhớ bác lòng ta thêm ấm lòng vườn nhà ngát hương cau mái tranh quê xôn xao mấy tình đời xưa theo phường đi nghe hát nay bác đã cho đời ta ơi câu ca độc lập tự do mà nay toàn dân ta hát vang nỗi ước mong thuở xưa đã đến rồi ấy rạng rỡ nay hát câu đò đưa thấy đời đẹp mênh mông càng nhớ bác nhớ ơn người sâu nặng quê hương,cach-mang
