title,singer,lyric,genre
Tổ Quốc Yêu Thương,Quốc Hưng (NSƯT),ta đi trên đường mùa xuân đường vang muôn tiếng hát thân thương trong ánh mắt nụ cười rạng rỡ ba mươi năm mới có một ngày quê hương ơi biết mấy tự hào về đây nam bắc cầm tay ta hát trên con đường vui trời quê hương rộng cánh chim bay không còn bóng mây thù che lối nghe sóng biển rì rào cả hát như mạch máu dâng trào rộn trái tim ta bao buồn thương trôi qua ta say mê trong niềm tin yêu bao mẹ bao em ta rạng rỡ lên như ngàn đóa hoa những ánh mắt chan hòa yêu thương bao lâu mơ ước sum vầy thỏa lòng trông đợi những lứa đôi ước hẹn tuy xa cách nhưng lòng thầm nhắc nhau ngày toàn thắng tổ quốc ơi có bao giờ đẹp như hôm nay ta đang sống trong ngày chói lọi của tổ quốc yêu thương tổ quốc việt nam anh hùng non sông nay lại về ta dòng sông xanh núi biếc reo ca bao đất mới sinh sôi mùa lúa quê hương ơi nối những nhịp cầu ta chung xây đất nước đẹp giàu về đây nam bắc kề vai tiến bước trên con đường vui biển quê hương lộng gió ngàn khơi có giọng hát trên thuyền kéo lưới trên đất này một màu xanh mới đây màu xanh hy vọng màu xanh tương lai trong ngày vui hôm nay ghi công ơn bác hồ kính yêu trên đường vui hôm nay thêm mến yêu anh giải phóng quân những chiếc mũ tai bèo thân thương anh qua bao núi bao rừng muôn vàn gian khổ máu các anh đã đổ cho sông núi càng rực rỡ trong ngày toàn thắng tổi quốc ơi có bao giờ đẹp như hôm nay ta đang sống những ngày chói lọi của tổ quốc yêu thương tổ quốc việt nam ngàn đời nở hoa,cach-mang
"Trường Sơn Đông, Trường Sơn Tây",Kiều Hưng (NSƯT), hiện chưa có lời bài hát nào cho trường sơn đông trường sơn tây do ca sĩ kiều hưng nsưt trình bày bạn có thể click vào đây để đăng lời cho bài hát này,cach-mang
Chiến Sĩ Công An Làm Theo Lời Bác,Triệu Lộc, hiện chưa có lời bài hát nào cho chiến sĩ công an làm theo lời bác do ca sĩ triệu lộc trình bày bạn có thể click vào đây để đăng lời cho bài hát này,cach-mang
Có Chúng Tôi (Hành Khúc Cảnh Sát Cơ Động),V.A, hiện chưa có lời bài hát nào cho có chúng tôi hành khúc cảnh sát cơ động do ca sĩ va trình bày bạn có thể click vào đây để đăng lời cho bài hát này,cach-mang
Đêm Trường Sơn Nhớ Bác,Thăng Long Band, hiện chưa có lời bài hát nào cho đêm trường sơn nhớ bác do ca sĩ thăng long band trình bày bạn có thể click vào đây để đăng lời cho bài hát này,cach-mang
Tuổi Xuân Dâng Đảng,Lạc Việt, hiện chưa có lời bài hát nào cho tuổi xuân dâng đảng do ca sĩ lạc việt trình bày bạn có thể click vào đây để đăng lời cho bài hát này,cach-mang
Có Ai Về Thanh Hóa,Lê Anh Dũng, hiện chưa có lời bài hát nào cho có ai về thanh hóa do ca sĩ lê anh dũng trình bày bạn có thể click vào đây để đăng lời cho bài hát này,cach-mang
Ở Hai Đầu Nỗi Nhớ,Thúy Hiền, hiện chưa có lời bài hát nào cho ở hai đầu nỗi nhớ do ca sĩ thúy hiền trình bày bạn có thể click vào đây để đăng lời cho bài hát này,cach-mang
Hát Về Người Thương Binh Anh Hùng,Huy Quyết,còn sức là còn lao động là còn cống hiến còn thi đua tiếng nói từ trái tim của người con đất cảng của người thương binh quân đoàn 4 anh hùng người lính trần hồng quảng năm xưa tỏa sáng trần hồng quảng hôm nay trên thành phố hải phòng hoa phượng đỏ tình yêu ngọn đuốc trần hồng quảng giương cao tỏa sáng cùng tập thể thương binh cho dù vết đạn còn đau quặng cả mùa đông hát về anh tôi hát về anh về người thương binh mãi tuổi đôi mươi khát vọng lòng trào dâng con sóng bạch đằng giang gửi vào đây gửi niềm tin trong dang dở cuộc đời cuộc đời của những thương binh người chiến sỹ lại bên nhau vượt qua bao thách thức có những người thương binh có những người thương binh mang dòng máu anh hùng xiết chặt tay nhau sống vì quê hương đẹp những ước mơ,cach-mang
Giai Điệu Tự Hào,Lạc Việt, hiện chưa có lời bài hát nào cho giai điệu tự hào do ca sĩ lạc việt trình bày bạn có thể click vào đây để đăng lời cho bài hát này,cach-mang
Cây Lúa Hàm Rồng,Phạm Phương Thảo,hôm nao cây lúa ven cầu dưới ánh đèn dù soi sáng đêm thâu dòng sông mã soi bóng nhịp cầu có những đoàn tàu hối hả về nam sao đêm đêm nghe náo nức đây tiếng con tàu hay tiếng tim em ơi cây lúa quê mình xanh biếc nhớ thương ơ ớ ai đi phương nam ai về phương bắc cầu ta vẫn chắc nối mạch yêu thương như lúa em vẫn đứng thẳng hàng cũng vì thương nhớ miền nam ai đi nơi xa nhớ tình cây lúa tháng ngày xanh tốt giữa nơi đây trên quê em đất lửa hàm rồng em san lấp hố bom này cho những đường cày thẳng tắp vươn xa dòng sông mã vang tiếng ai hò thấp thoáng buồm về nắng đượm chiều nay ôi quê hương trong tiếng súng vẫn sáng tươi màu vẫn đứng hiên ngang ơi sông mã núi rồng tươi thắm chiến công ơ ớ ơi con sông xa thu bồn nước mát hòa chung tiếng hát với đồng quê ta bao máu xương thấm đất ruộng cày lúa này nặng những phù sa ơ ờ đây quê hương ta bên dòng sông mã tấm lòng son sắt vẫn trung kiên qua gian lao vẫn nổi câu hò là hò hò hơ ơi hò hò hơ ơ hò hàm rồng ơi ơ ơi,cach-mang
Bài Ca Dân Quân,Châu Thùy Dương, hiện chưa có lời bài hát nào cho bài ca dân quân do ca sĩ châu thùy dương trình bày bạn có thể click vào đây để đăng lời cho bài hát này,cach-mang
Đường Về Thanh Hóa,Hoài Thương, hiện chưa có lời bài hát nào cho đường về thanh hóa do ca sĩ hoài thương trình bày bạn có thể click vào đây để đăng lời cho bài hát này,cach-mang
Trường Ca Sông Lô,Quốc Hưng (NSƯT), hiện chưa có lời bài hát nào cho trường ca sông lô do ca sĩ quốc hưng nsưt trình bày bạn có thể click vào đây để đăng lời cho bài hát này,cach-mang
Đường Trường Sơn Xe Anh Qua,"Phi Hùng, V.A", hiện chưa có lời bài hát nào cho đường trường sơn xe anh qua do ca sĩ phi hùng va trình bày bạn có thể click vào đây để đăng lời cho bài hát này,cach-mang
Việt Nam Ơi,"Hoàng Nghiệp, Thanh Tâm, Thái Châu", hiện chưa có lời bài hát nào cho việt nam ơi do ca sĩ hoàng nghiệp thanh tâm thái châu trình bày bạn có thể click vào đây để đăng lời cho bài hát này,cach-mang
Tôi Yêu Tổ Quốc Tôi,Hà Thế Dũng, hiện chưa có lời bài hát nào cho tôi yêu tổ quốc tôi do ca sĩ hà thế dũng trình bày bạn có thể click vào đây để đăng lời cho bài hát này,cach-mang
Biết Ơn Chị Võ Thị Sáu Remix,"Gia Tiến, Thanh Ngân", hiện chưa có lời bài hát nào cho biêt ơn chi vo thi sau remix do ca sĩ gia tiến thanh ngân trình bày bạn có thể click vào đây để đăng lời cho bài hát này,cach-mang
Bài Ca Hy Vọng,Sen Việt, hiện chưa có lời bài hát nào cho bài ca hy vọng do ca sĩ sen việt trình bày bạn có thể click vào đây để đăng lời cho bài hát này,cach-mang
Vinh Quang Kim Quang Những Người Con Bất Tử,V.A,núi bà đen sừng sững hiên ngang che chở bộ đội trong khe động kim quang vinh quang tự hào những người con bất tử cho kim quang hôm nay lừng lãy những chiến công cho tây ninh viết tiếp bài ca tự hào năm xưa nơi đây có những người con năm xưa nơi đây chiến đấu anh hùng quyết chiến đấu cho quê hương quyết giữ gìn từng tất đất cho tây ninh ôi những người con trung dũng kiên cường quyết tử cho tổ quốc quyết sinh chiến đấu ngoan cường vì độc lập tự do kim quang năm xưa có những người con bất tử kim quang hôm nay hát mãi khúc ca tự hào vang danh tự hào núi bà hiên ngang chiến tích lẫy lừng rạng rỡ kim quang biết mấy tự hào những người con bất tử kim quang năm xưa lừng lẫy với những chiến công kim quang hôm nay vẻ vang khúc ca tự hào,cach-mang
Ngưởi Giỏi Chăn Nuôi,Anh Thơ, hiện chưa có lời bài hát nào cho ngưởi giỏi chăn nuôi do ca sĩ anh thơ trình bày bạn có thể click vào đây để đăng lời cho bài hát này,cach-mang
"LK Xuân Chiến Khu, Bài Ca May Áo, Chiếc Xuồng Quê Hương","Hà Phạm, Ayor", hiện chưa có lời bài hát nào cho lk xuân chiến khu bài ca may áo chiếc xuồng quê hương do ca sĩ hà phạm ayor trình bày bạn có thể click vào đây để đăng lời cho bài hát này,cach-mang
Hào Khí Lạc Việt,Đỗ Hữu Vị,tác giả đỗ hữu vị giám đốc công ty thiên phú an hà nội người luyện võ võ luyện người người luyện võ võ luyện người hey hey hey hey hey cuồn cuộn sóng sông hồng dạt dào sóng biển đông cương nhu cùng quyền cước bay bổng khắp non sông ơi lạc việt võ đạo nào cùng nhau bay lên ta cùng nhau bay lên ta bay qua đại dương ta bay lên tầm cao ta bay vào vũ trụ ta phủ kín toàn cầu tinh thần thượng võ việt nam tinh thần thượng võ việt nam,cach-mang
Lòng Dân Tây Nguyên Với Bác Hồ,V.A, hiện chưa có lời bài hát nào cho lòng dân tây nguyên với bác hồ do ca sĩ va trình bày bạn có thể click vào đây để đăng lời cho bài hát này,cach-mang
Bác Hồ Một Tình Yêu Bao La,Thu Huyền (NSƯT), hiện chưa có lời bài hát nào cho bác hồ một tình yêu bao la do ca sĩ thu huyền nsưt trình bày bạn có thể click vào đây để đăng lời cho bài hát này,cach-mang
Tự Hào Chiến Sĩ Miền Đông,Thanh Tuấn, hiện chưa có lời bài hát nào cho tự hào chiến sĩ miền đông do ca sĩ thanh tuấn trình bày bạn có thể click vào đây để đăng lời cho bài hát này,cach-mang
Người Mẹ Của Tôi,Trung Hậu,nước mắt mẹ không còn vì khóc những đứa con lần lượt ra đi đi mãi mãi thời gian trôi qua vết thương trên thịt da đã lành theo năm tháng nhưng vết thương lòng mẹ vẫn còn nặng mang mẹ việt nam ơi mẹ việt nam ơi khi con đi qua khắp nẻo đường nghe đau thương chìm trong khói hương mong sao cơn mưa gió vô thường không lung lay làm rớt hạt sương mẹ việt nam ơi mẹ việt nam ơi mây khói tan rồi còn lại mẹ tôi đất nước nay vẫn còn còn những đứa con dù đi xa muôn phương vẫn nhớ mẹ đang cô đơn chúng con yêu mẹ hơn mỗi chiều nghiêng nghiêng bóng ghi khắc trong lòng hình dáng mẹ ngồi trông mẹ việt nam ơi mẹ việt nam ơi cho con xin chia sớt nỗi buồn cho con xin sẻ đôi bát cơm cho con hôn đôi mắt mỏi mòn cho con soi lại bóng hình con mẹ việt nam ơi mẹ việt nam ơi xin cám ơn người người mẹ của tôi,cach-mang
Có Những Tuổi 20 Như Thế,Lạc Việt, hiện chưa có lời bài hát nào cho có những tuổi 20 như thế do ca sĩ lạc việt trình bày bạn có thể click vào đây để đăng lời cho bài hát này,cach-mang
Lời Người Vọng Vang,Tùng Dương, hiện chưa có lời bài hát nào cho lời người vọng vang do ca sĩ tùng dương trình bày bạn có thể click vào đây để đăng lời cho bài hát này,cach-mang
Xin Mưa Rào Lên Đỉnh E5,Tuấn Anh (NSƯT), hiện chưa có lời bài hát nào cho xin mưa rào lên đỉnh e5 do ca sĩ tuấn anh nsưt trình bày bạn có thể click vào đây để đăng lời cho bài hát này,cach-mang
Nghĩa Tình Việt,Lào, hiện chưa có lời bài hát nào cho nghĩa tình việt lào do ca sĩ va trình bày bạn có thể click vào đây để đăng lời cho bài hát này,cach-mang
Bài Ca Người Lính Tàu Ngầm,Y Jang Tuyn, hiện chưa có lời bài hát nào cho bài ca người lính tàu ngầm do ca sĩ y jang tuyn trình bày bạn có thể click vào đây để đăng lời cho bài hát này,cach-mang
Tuổi Trẻ Của Bác Hồ,CLB Giai Điệu Trẻ TP Cần Thơ,tuổi trẻ của bác hồ là bài ca hùng tráng tuổi trẻ của bác hồ từ trong đêm tối mất nước và nô lệ người ra đi tìm đường và đã thấy con đường giải phóng nhân dân việt nam và giải phóng cho nhân loại tuổi trẻ của bác hồ vượt đại dương dậy sóng vượt cả tay mắt quân thù người đi đến khắp các nước mọi châu lục còn áp bức đọa đày còn tiếng thét vang trời giải phóng nhân dân lầm than và giải phóng các dân tộc rồi một sớm bác đã về quê hương núi rừng việt bắc đó muôn đóa hoa dâng người tin mừng truyền vang nơi nơi muôn triệu người con ra đi một lòng thề cứu lấy nước non rồi một sớm trong nắng mùa thu bác hồ đọc tuyên ngôn như sấm vang ba đình vang vọng trời xanh quê hương vang vọng biển xanh năm châu rừng cờ đỏ thắm lấp lánh ánh sao vàng tuổi trẻ của bác hồ cả hồn thiêng tổ quốc vọng về trong trái tim người đi giải phóng giai cấp và dân tộc người giương cao ngọn cờ vì chủ nghĩa xã hội đoàn kết công nông việt nam và đoàn kết cả dân tộc tuổi trẻ của bác hồ là bài ca đoàn kết cội nguồn của sức mạnh để chiến thắng đế quốc và xâm lược mừng non sông vẹn toàn ngày thống nhất huy hoàng lời bác thiêng liêng còn đây tuổi trẻ bác sáng muôn đời,cach-mang
Liên Khúc Qua Miền Tây Bắc,V.A, hiện chưa có lời bài hát nào cho liên khúc qua miền tây bắc do ca sĩ va trình bày bạn có thể click vào đây để đăng lời cho bài hát này,cach-mang
Hưng Đạo Đại Vương,Viết Danh, hiện chưa có lời bài hát nào cho hưng đạo đại vương do ca sĩ viết danh trình bày bạn có thể click vào đây để đăng lời cho bài hát này,cach-mang
Có Một Vì Sao Trong Tim,"Lê Minh Đức, Trường Thư",khi em cài huy hiệu đoàn lên ngực trái tim em lấp lánh một vì sao vì sao ấy ngời trong đêm tối và bừng lên soi sáng những ước ao khi em cài huy hiệu đoàn lên ngực trái tim em rạng rỡ một vần thơ vần thơ ấy bồi hồi rạo rực hòa tình ta chung một sắc cờ hãy cài huy hiệu đoàn lên ngực trên chiếc áo xanh và trong trái tim em sẽ thấy rằng em rất đẹp như hoa hướng dương chào đón bình minh đất nước gọi ta đi về phía trước sáng tạo tiên phong xây dựng tổ quốc mình hãy cài huy hiệu đoàn lên ngực mang hết tuổi xanh dâng cho quê hương hoài bão ấy như hồi kèn thúc giục trên con đường dài vang dội không thôi đất nước gọi ta đi về phía trước xung kích trung kiên bảo vệ tổ quốc mình,cach-mang
Em Ở Nông Trường Em Ra Biên Giới,CLB Giai Điệu Trẻ TP Cần Thơ,trên nông trường không xa lắm có đôi chân đi không ngại ngần em bây giờ mưa nắng gánh trên vai vấn vương bụi trần từng vai áo phai sẽ xanh them đời bàn tay làm nên những mùa vui từ trên đất này những con người mới mọc lên tựa tia nắng giữa chân trời qua bao mùa em bổng lớn đất cho em trái tim nồng nàn yêu con người nên lo lắng muốn nghiên vai gánh thêm nhọc nhằn xa nông trường ra biên giới có đôi khi đi không trở lại nhưng trong lòng nghe tiếng nói những gian nan sẽ đo lòng người từ biên giới xa chon em sương mù rừng sâu tìm những lối mòn qua từng khi nắng mưa lán đêm nằm nhớ màu đất trời quá chốn quê nhà khi qua rừng khi qua suối thất vui theo bước chân đồng đội trong những ngày gian nguy ấy biết bao nhiêu những câu chuyện đời,cach-mang
Hồ Chí Minh Giai Điệu Bốn Mùa,V.A, hiện chưa có lời bài hát nào cho hồ chí minh giai điệu bốn mùa do ca sĩ va trình bày bạn có thể click vào đây để đăng lời cho bài hát này,cach-mang
Việt Nam Non Nước Tôi,Lạc Việt, hiện chưa có lời bài hát nào cho việt nam non nước tôi do ca sĩ lạc việt trình bày bạn có thể click vào đây để đăng lời cho bài hát này,cach-mang
Bước Chân Trên Dãy Trường Son,Lạc Việt, hiện chưa có lời bài hát nào cho bước chân trên dãy trường son do ca sĩ lạc việt trình bày bạn có thể click vào đây để đăng lời cho bài hát này,cach-mang
Người Lính Quân Hàm Xanh,V.A, hiện chưa có lời bài hát nào cho người lính quân hàm xanh do ca sĩ va trình bày bạn có thể click vào đây để đăng lời cho bài hát này,cach-mang
Xin Đón Các Anh Về,Vũ Tiến Lâm (NSƯT), hiện chưa có lời bài hát nào cho xin đón các anh về do ca sĩ vũ tiến lâm nsưt trình bày bạn có thể click vào đây để đăng lời cho bài hát này,cach-mang
Con Tàu Thanh Niên,Sỹ Hùng BTA,là lá lá lá la là la là lá lá lá la là lá la là la lá lá là là là la lá la ngọn cờ tổ quốc rực rỡ tung bay giữa đảo xa giữa mênh mông biển trời dạt dào biển hát tiếng vọng từ ngàn xưa tuổi trẻ ông cha lên đường giữ nước vì tương lai quê hương thanh xuân chẳng màng xương máu hy sinh giữ ngọn cờ tranh đấu thanh niên hôm nay nguyện xông pha tiến bước dựng xây non sông việt nam tươi sáng rạng ngời là lá lá lá la là la là lá lá lá la là lá la là la lá lá là là là la lá la rạng ngời tổ quốc màu áo thanh niên từ đảo xa đến biên cương núi rừng vượt ngàn gian khó như con tầu vươn khơi tuổi trẻ hôm nay xây hoài bão lớn vì tương lai quê hương thanh niên sẵn sàng dâng hiến thanh xuân vững ngọn cờ tiến bước thanh niên hôm nay rèn tâm trong trí sáng dựng xây non sông việt nam rạng rời muôn đời thanh niên ơi nhìn thẳng hướng mặt trời thuận gió dương buồm mạnh mẽ vượt biển khơi thanh niên ơi cùng góp sức xây đời tô thắm dạng ngời truyền thống ngàn năm noi theo ông cha dựng xây đất nước thanh niên hôm nay lập thân kiến quốc để mãi mãi con tàu lướt sóng vươn khơi,cach-mang
Con Không Về Kịp Mẹ Ơi,Hồ Đức Hùng, hiện chưa có lời bài hát nào cho con không về kịp mẹ ơi do ca sĩ hồ đức hùng trình bày bạn có thể click vào đây để đăng lời cho bài hát này,cach-mang
Những Cô Gái Đồng Bằng Sông Cửu Long,Xuân Thanh, hiện chưa có lời bài hát nào cho những cô gái đồng bằng sông cửu long do ca sĩ xuân thanh trình bày bạn có thể click vào đây để đăng lời cho bài hát này,cach-mang
Đảng Ở Trong Tôi,Công Thanh,đảng ở trong tôi như là người mẹ đảng ở trong tôi như là người cha đảng ở trong tôi như là anh chị đảng ở trong tôi giản dị rất gần đảng ở trong tôi đảng ở trong tôi tổ quốc việt nam qua bao lần sóng gió biển đảo thân yêu hoàng sa trường sa nắm vững tay chèo đảng cầm lái vượt qua mang lại tự do ấm no hạnh phúc cho nhân dân đảng ở trong tôi đảng ở trong tôi đảng ở trong tôi chỉ giản dị thế thôi đảng ở trong tôi mãi mãi ở trong tôi đảng ở trong tôi như là mặt trời đảng ở trong tôi như là vầng trăng đảng dạy cho tôi yêu tổ quốc mình ngọn lửa tin yêu rực hồng sáng ngời việt nam muôn năm việt nam muôn năm dòng máu triệu dân đã hòa vào đất nước vượt mọi gian lao đảng vững niềm tin bước tiếp chặng đường mà bác đã dựng xây mang lại tự do ấm no hạnh phúc cho nhân dân việt nam muôn năm việt nam muôn năm ngàn lời tin yêu tự hào được hát lên đảng cộng sản việt nam mãi mãi ở trong tôi,cach-mang
Tổ Quốc,Quốc Hưng (NSƯT),nếu có thể đo xương máu tiền nhân trường sơn ngút ngàn dễ gì so được bao người mẹ người vợ người em nước mắt hồng hà cửu long đâu thể sánh cùng bão trường chinh ào ạt mấy ngàn năm ào ạt mấy ngàn năm châu thổ những bờ đê chắn lũ ngăn thù bọc trứng tiên rồng các con đi trăm ngả vẫn thắm lòng dưa hấu chốn đảo xa ào ạt mấy ngàn năm thánh gióng mới lên ba đã giáp sắt tre ngà câu thơ thần nhuộm đỏ sông như nguyệt đỏ bạch đằng cuồn cuộn sóng bể xa mấy ngàn năm vọng phu hóa đá phụ tử bùi ngùi doi đất trời nam những cuộc chia ly những vành khăn trắng chẳng nguôi ngoai dù xác giặc chất chồng chẳng thể dịu nỗi rạch gầm xoài mút hiền lương khâm thiên sơn mỹ thổ chu máu vị xuyên gạc ma bầm chát vạn nghĩa trang hương khói nguyện cầu ôi tổ quốc biên cương chưa yên giấc đêm quặn lòng máu thịt hoàng sa ngày đỏ mắt trường sa giông bão lại bút gươm giữ cõi xây nhà,cach-mang
Hát Về Cây Lúa Hôm Nay,Quốc Hưng (NSƯT), hiện chưa có lời bài hát nào cho hát về cây lúa hôm nay do ca sĩ quốc hưng nsưt trình bày bạn có thể click vào đây để đăng lời cho bài hát này,cach-mang
Những Người Hát Bè Trầm,Phạm Chiến,hờ hơ hớ hờ hơ hớ hờ hơ hơ hớ hơ hơ hờ hờ hơ hớ hờ hơ hớ hờ hơ hơ hớ hơ hơ hờ hờ những người hát bè trầm bài hát không có lời người hát không thấy mặt nghe rất xa mà cũng rất gần những người hát bè trầm bài hát không có lời người hát chẳng thấy đâu không có ai nhìn thấy họ trên đời bài hát bay theo năm tháng vang lên trong tim mình họ đi xa chẳng gửi lại một lời nhưng giữa cuộc đời lời hát vẫn âm vang nhữngngười hát bè trầm là những người mẹ người cha là những người anh người chị đã ngã xuống hôm qua hóa thành bài ca họ đã hát bè trầm cho anh họ đã hát bè trầm cho tôi cho đất nước này vươn tới đỉnh bè cao hờ hơ hớ hờ hơ hớ hờ hơ hơ hớ hơ hơ hờ hờ hơ hớ hờ hơ hớ hờ hơ hơ hớ hơ hơ hờ hờ những người hát bè trầm bài hát không có lời người hát không thấy mặt nghe rất xa mà cũng rất gần những người hát bè trầm bài hát không có lời người hát chẳng thấy đâu không có ai nhìn thấy họ trên đời bài hát bay theo năm tháng vang lên trong tim mình họ đi xa chẳng gửi lại một lời nhưng giữa cuộc đời lời hát vẫn ngân vang những người hát bè trầm là những người mẹ người cha là những người anh người chị đã ngã xuống hôm qua hóa thành bài ca họ đã hát bè trầm cho anh họ đã hát bè trầm cho tôi cho đất nước này vươn tới đỉnh bè cao lời hát theo ta đi mãi ngân vang trong tim mình người ra đi chẳng gửi lại một lời nhưng cả cuộc đời vẫn mãi mãi xanh tươi những người hát bè trầm nằm xuống dọc đường trường sơn là những là những đồng đội đã ngã xuống hôm qua hóa thành bài ca họ đã hát bè trầm cho anh họ đã hát bè trầm cho tôi cho đất nước này vươn tới đỉnh bè cao họ đã hát bè trầm cho anh họ đã hát bè trầm cho tôi cho đất nước này vươn tới đỉnh bè cao họ đã hát bè trầm cho anh họ đã hát bè trầm cho tôi cho đất nước này vươn tới đỉnh bè cao,cach-mang
Con Gái Mẹ Nay Đã Thành Chiến Sĩ,V.A, hiện chưa có lời bài hát nào cho con gái mẹ nay đã thành chiến sĩ do ca sĩ va trình bày bạn có thể click vào đây để đăng lời cho bài hát này,cach-mang
Đất Nước Lời Ru,Tố Nga, hiện chưa có lời bài hát nào cho đất nước lời ru do ca sĩ tố nga trình bày bạn có thể click vào đây để đăng lời cho bài hát này,cach-mang
Yêu Lính Đảo Xa,Viết Đại, hiện chưa có lời bài hát nào cho yêu lính đảo xa do ca sĩ viết đại trình bày bạn có thể click vào đây để đăng lời cho bài hát này,cach-mang
