title,singer,lyric,genre
Thủ Đô Khói Lửa,Thúy Lan (NSƯT),thủ đô thân yêu của ta hà nội thân yêu của ta có bao giờ quên những ngày thủ đô thân yêu đang ngập trong khói lửa sôi máu căm thù vung gươm mang súng cùng xông lên trông vời ngàn xưa oai linh mà nuôi chí bền cùng đi đi lên đất nước kêu gọi bước tiến lửa reo thăng long trang hùng xưa đã mở đi cứu nước nhà thanh niên đâu sá gì xông pha kinh kì từng phen lao lung dẹp tan bóng thù đi ta đi nuôi chí giữ yên cơ đồ kia trông hồ gươm ánh hào quang vẫn trên ngọn tháp cũ sông hồng cuộn dâng dòng hờn căm vẫn tràn ngập xác thù hà nội ơi ngàn năm đã sẵn sàng ta sát vai cùng nhau thề chiến thắng quân dân thủ đô súng và gươm quyết tranh từng góc phố bảo vệ thủ đô diệt cho tan lũ ngoại xâm điên rồ hà nội ơi ngàn năm vẫn vững vàng với núi sông việt nam hùng thiêng,tien-chien
Bà Mẹ Quê,Thái Hằng,vườn rau vườn rau xanh ngắt một màu có đàn có đàn gà con nương náu mẹ quê mẹ quê vất vả trăm chiều nuôi đàn nuôi một đàn con chắt chiu bà bà mẹ quê gà gáy trên đầu ngọn tre bà bà mẹ quê chợ sớm đi chưa thấy về chờ nụ cười son và đồng quà ngon trời mưa trời mưa ướt áo mẹ già mưa nhiều mưa nhiều càng tươi bông lúa trời soi trời soi bốc khói sân nhà nắng nhiều nắng nhiều thì phơi lúa ra bà bà mẹ quê đêm sớm không nề hà chi bà bà mẹ quê ngày tháng không ao ước gì nhỏ giọt mồ hôi vì đời trẻ vui miệng khô miệng khô nhớ bát nước đầy nhớ bà nhớ bà mẹ quê xưa ấy mùa đông mùa đông manh chiếu thân gầy cháu bà cháu bà ngủ thiu rất say,tien-chien
Du Kích Sông Thao,"Thái Thanh, Anh Ngọc",hồng hà mênh mông trôi cát tới chân làng quê cuối sông nhiều bến ai về có thấy làn gió xanh rì bát ngát đồng lúa ven bờ đê hồng hà trôi xuôi đưa nước trên ngàn về khơi sông thao ngoài bến việt trì có những chàng áo nâu về say mê dòng nước vui tràn trề ven sông người đông đến họp chợ chiều vui bên dòng sông lúa ngập đầy đồng sông hồng hà reo u u u ù khi đi lập công cuối trời màu hồng vui bên dòng sông lúa ngập đầy đồng sông hồng hà reo sông hồng hà reo hồng hà ơi ta nhớ mùa thu xưa nước về như bóng cờ lên khi quân về thủ đô hồng hà ơi nay cũng mùa thu thấy mơ màng ngao ngán nhìn sông bên việt trì còn đó hồng hà reo ai đó cùng ta đang phơi bày với nước phù sa đang pha hòa dòng lô hồng hà ơi ðây những người bao năm lạc loài mơ ước được mong sao quay về quê nhà,tien-chien
Ta Vui Ca Vang,"Thanh Lan, Phương Hồng Quế, Phương Hồng Ngọc", hiện chưa có lời bài hát nào cho ta vui ca vang do ca sĩ thanh lan phương hồng quế phương hồng ngọc trình bày bạn có thể click vào đây để đăng lời cho bài hát này,tien-chien
Xóm Đêm,Lệ Quyên,đường về canh thâu đêm khuya ngõ sâu như không mầu qua phên vênh có bao mái đầu hắt hiu vàng ánh điện câu đường dài không bóng xa nghe tiếng ai ru mơ màng mưa rơi rơi xóa lối đi mòn có đôi lòng vững chờ mong ai chia tay ai đầu xóm vắng im lìm ai rung lên tia mắt ngàn câu êm đềm mong sao cho duyên nghèo mai nắng gieo thêm đẹp kiếp sống thêm màn đêm tịch liêu nghe ai thoáng ru câu mến trìu nghe không gian tiếng yêu thương nhiềụ hứa cho đời thôi đìu hiu đêm tha hương ai vọng trông đêm cô liêu chinh phụ mong đêm bao canh mưa âm thầm theo gió về khua cơn mộng hẹn mai ánh xuân nồng cho nên đêm còn dậy hương để dìu bước chân ai trên đường để nhìn xóm khuya không buồn vì người biết mang tình thương,tien-chien
Xin Anh Giữ Trọn Tình Quê,Thùy Dương, hiện chưa có lời bài hát nào cho xin anh giữ trọn tình quê do ca sĩ thùy dương trình bày bạn có thể click vào đây để đăng lời cho bài hát này,tien-chien
Người Lính Và Mùa Xuân,Hoài Phương, hiện chưa có lời bài hát nào cho người lính và mùa xuân do ca sĩ hoài phương trình bày bạn có thể click vào đây để đăng lời cho bài hát này,tien-chien
Đêm Đông,Lệ Quyên,chiều chưa đi màn đêm rơi xuống đâu đấy buông lững lờ tiếng chuông đôi cánh chim bâng khuâng rã rời cùng mây xám về ngang lưng trời thời gian như ngừng trong tê tái cây trút lá cuốn theo chiều mây mưa giăng mắc nhớ nhung tiêu điều sương thướt tha bay ôi đìu hiu đêm đông xa trông cố hương buồn lòng chinh phu đêm đông bên song ngẩn ngơ kìa ai mong chồng đêm đông thi nhân lắng nghe tâm hồn tương tư đêm đông ca nhi đối gương ôm sầu riêng bóng gió nghiêng chiều say gió lay ngàn cây gió nâng thuyền mây gió reo sầu miên gió đau niềm riêng gió than triền miên đêm đông ôi ta nhớ nhung đường về xa xa đêm đông ta mơ giấc mơ gia đình yêu đương đêm đông ta lê bước chân phong trần tha phương có ai thấu tình cô lữ đêm đông không nhà đời như vô tình ta ngao ngán non nước thê thảm mang cảnh tang thân lãng du cô liêu chán chường về đâu giữa trời đông đêm trường sầu lên khơi hồn quê lai láng ta van gió nhân mưa ngừng than cho ta lắng tiếng vang muôn lòng rên rỉ qua không gian buồn mong,tien-chien
Nhớ Mẹ 2,Gia Tiến, hiện chưa có lời bài hát nào cho nhơ me 2 do ca sĩ gia tiến trình bày bạn có thể click vào đây để đăng lời cho bài hát này,tien-chien
Em Chọn Lối Này,Anh Thơ,chân em đi rừng nhiều đường lắm lối này người ơi nhưng em chọn lối này em đây chọn lối này thôi lối ấy con chim rừng hót vang con nai rừng lắng nghe cây tre cây lim nhường lối cho tiếng cuốc tiếng chuông vang vang lối ấy có ánh trăng rọi đường có tiếng suối trong ban mai tiếng giã gạo trong sông này là lối về bản em đây lối ấy mồ hôi anh đã rơi mở con đường ấm no lên bản em đưa núi rừng tiến kịp miền xuôi đường của đảng dẫu còn ngàn tăm tối lối em đi chân em đi em đã chọn rồi,tien-chien
Giọt Mưa Thu,Anh Thơ,ngoài hiên giọt mưa thu thánh thót rơi trời lắng u buồn mây hắt hiu ngừng trôi nghe gió thoảng mơ hồ trong mưa thu ai khóc ai than hờ vài con chim non chiêm chiếp kêu trên cành như nhủ trời xanh gió ngừng đi mưa buồn chi cho cõi lòng lâm ly hồn thu tới nơi đây gieo buồn lây lòng vắng muôn bề không liếp che gió về ai nức nở thương đời châu buông mau dương thế bao la sầu người mong mây tan cho gió hiu hiu lạnh mây ngỏ trời xanh chắc gì vui mưa còn rơi bao kiếp sầu ta nguôi gió xa xôi vẫn về mưa giăng mù lê thê đến bao năm nữa trời vợ chồng ngâu thôi khóc vì thu,tien-chien
Hai Vì Sao Lạc,Trường Vũ,người về một mùa thu gió heo mây về đâu có nhớ chăng những vì sao long lanh đưa tiễn người một đêm không trăng nói sao nên lời lòng buồn như chiều rơi như trong đêm khuya những bước chân qua thềm gợi niềm thương nhớ vô vàng người về đường đi kết gió trăng sao người đi có biết chăng trong chiều nay bơ vơ nghe lá thu vàng rơi bâng khuâng bước chân ai về chừng thời gian ngừng trôi như quên đêm khuya để gió sương thêu thùa thầm làm ướt áo vai gầy người về chiều mưa hay nắng sao để khói lam chiều như se chùng màu không gian người về dòng sông thương nhớ để bến vắng con đò buồn mong người người hay chăng người là vì sao nhỏ bé ta mãi ước cho lòng mình là bầu trời xanh xanh người về lòng ta thương nhớ ta khẽ hỏi đưa người hay thầm người đưa ta người về người về đâu nhớ ta chăng người ơi mỗi lá thu rơi làm ta bâng khuâng như áng mây chiều lam trong sương bước đi âm thầm lòng buồn như chiều rơi nghe chăng thu ơi để lá rơi chi hoài gợi lòng thương nhớ ai nhiều,tien-chien
Chiếc Khăn Piêu,Tùng Dương,tiếng tôi vang rừng núi sao không ai trả lời nhắn tin theo cùng gió khăn còn đây đợi người nghe con chim cúc cu kìa nó hát lên một câu rằng có một nàng ở trong rừng tìm trong rừng kiếm trong rừng chiếc khăn piêu chiếc khăn piêu chiêc khăn piêu thêu chỉ hồng theo gió cuốn bay về đâu chiêc khăn piêu thêu chỉ hồng theogió cuốn bay về đây vương trên cây astri ơi tới đây nhặt lấy chiếc khăn đẹp này thôi này đừng tìm trong rừng lạc trong rừng nát hoa rừng khăn piêu đây á ơi có phải thắm thiết duyên nhau chiếc khăn để làm mối nối duyên nhau thời tôi chờ,tien-chien
Bài Ca Đất Phương Nam,Hương Lan,nhắn ai đi về miền đất phương nam trời xanh mây trắng soi dòng cửu long giang mênh mông rừng tràm bạt ngàn dừa xanh tiếng chang đước đong đưa nhớ người xưa từng ở nơi này cho ta thêm yêu dấu chân ngàn năm đi mở đất cho ta thêm yêu bầy chim sáo sổ lồng còn đâu đây tiếng vó ngựa phi mà ngỡ con tàu vỗ sóng bờ xa nỉ non sao tiếng nhạn kêu chiều buồm xuôi vô phương nam phiêu bạt theo thủy triều dẫu trải qua thăng trầm giông tố qua bao cuộc bể dâu mãi dâng cho đời bài tình ca đất phương nam cánh chim tung trời về đất phương nam người xưa lưu dấu in hình thuở mang gươm bao la tình đời màu lục bình trôi hoàng hôn tím ven sông tiếng hò khoan còn tỏa đôi bờ lênh đênh mây trôi khói sương chiều miên man nỗi nhớ nghe trong âm ba từng con sóng vỗ về chờ trăng lên cất tiếng gọi nhau đờn khảy tang tình đượm thắm hồn ai biển xôn xao gió lộng tứ bề thuyền ai xuôi phương nam khoan nhặt trôi lững lờ đã trải qua bao mùa mưa nắng qua bao cuộc đổi thay mãi dâng cho đời bài tình ca đất phương nam,tien-chien
Gửi Gió Cho Mây Ngàn Bay,Anh Thơ,với bao tà áo xanh đây mùa thu hoa lá tàn hàng cây đứng hững hờ lá vàng từng cánh rơi từng cánh rơi xuống âm thầm trên đất xưa gửi gió cho mây ngàn bay gửi bướm muôn màu về hoa gửi thêm ánh trăng màu xanh lá thư về đây với thu trần gian gửi gió cho mây ngàn bay gửi phím tơ đồng tìm duyên gửi thêm lá thư màu xanh ái ân về đôi mắt như hồ thu thấy hối tiếc nhiều thuyền đã sang bờ đường về không lối giòng đời trôi đã về chiều mà lòng mến còn nhiều đập gương xưa tìm bóng nhưng thôi tiếc mà chi chim rồi bay anh rồi đi đường trần quên lối cũ người đời xa cách mãi tình trần khôn hàn gắn thương lòng gửi gió cho mây ngàn bay gửi bướm đa tình về hoa gửi thêm ánh trăng màu xanh lá thư về đây với thu trần gian,tien-chien
Gửi Người Em Gái,Tùng Dương, cành hoa tim tím bé xinh xinh báo xuân nồng rừng đào phong kín cánh mong manh hé hoa lòng hà nội chờ đón tết hoa chen người đi liễu rũ mà chi đêm tân xuân hồ gươm như say mê chuông reo ngân ngọc sơn sao uy nghi ngàn phía đến lễ đền chạnh lòng tôi nhớ đến người em tôi có người em gái tuổi chớm dâng hương mắt nồng rộn ý yêu thương đôi mắt em nói nhiều tha thiết như dáng kiều ôi tình yêu nhưng một sớm mùa thu khép giữa trời tím ngắt nàng đi gót hài xanh người đi trong dạ sao đành đường xưa lối cũ ân tình nghĩa xưa rồi từ ngày sống xa anh nơi kim tiền ngục trần gian hãm tấm thân xinh đôi mắt hiền đời nghèo không lối thoát em đành thôi cúi đầu mà đi xuân đêm nay đường đêm catina hoa mai rơi rủ nhau nơi phương xa dần trắng xóa mặt đường một người em gái nhớ người thương rồi ngày thống nhất đến rất nhanh khôn ai ngừng cầu chia giới tuyến đến mai đây san đất bằng nụ cười trong gió sớm anh đến chờ em giữa cầu hiền lương em tôi đi màu son lên đôi môi khăn san bay lả lơi bên hai vai ai trời thắm gió trăng hiền hà nội thêm bóng dáng nàng tiên em tháp rùa yêu dấu còn đó trơ trơ lớp người đổi mới khác xưa thu đã qua những chiều song ý thơ rất nhiều cả tình yêu em nhẹ bước mà đi giữa khung trời bát ngát tình ta hết dở dang đường xưa lối ngập lá vàng đường nay thong thả bao nàng đón xuân lòng anh như giấy trắng thanh tàn ép hoa tàn thời gian vẫn giữ nét yêu đương nơi hoa vàng dịu lòng đàn dẫn phím ý thơ trào dâng viết gửi về em đêm hôm nao ngồi nghe qua không gian em tôi mơ miền xưa qua hương lan đường phố lóa ánh đèn một người trên đất bắc chờ em,tien-chien
Đại Nguyện,Lệ Hoa, hiện chưa có lời bài hát nào cho đại nguyện do ca sĩ lệ hoa trình bày bạn có thể click vào đây để đăng lời cho bài hát này,tien-chien
Ô Mê Ly (Ca Sĩ Ẩn Danh),Trần Tùng Anh, hiện chưa có lời bài hát nào cho ô mê ly ca sĩ ẩn danh do ca sĩ trần tùng anh trình bày bạn có thể click vào đây để đăng lời cho bài hát này,tien-chien
Mùa Xuân Sao Chưa Về Hỡi Em,Tuấn Ngọc,mùa xuân sao chưa về hỡi em xua mây tan cho những ngày nắng êm lũ chim non gửi gấm khúc tự tình gọi xuân cho xanh màu mắt em và mơ ước thắm thiết mãi lên cho ta nói yêu em hàng cây tro thân gầy mỏng manh mãi trông tin qua mùa lá xanh đón em xuân về bát ngát đầy trời gọi xuân cho thêm hồng má em còn đâu đó bóng dáng thướt tha cho ta hoài nhớ thương viết cho người và hát cho người từ một thuở vào xuân xa vời xin mau về mùa xuân trên đời để lòng người nở hoa rực rỡ như lòng ta vẫn chờ mùa xuân sao chưa về hỡi em cho yêu thương vun đầy mắt sâu sẽ quên đi ngày tháng cũ miệt mài chờ xuân lên cho lòng ngất say còn mãi đó với những dấu yêu trong đôi mắt thơ ngây từ xuân đi cho đời vắng nhau gom yêu thương đã từ bấy lâu hứa cho em dành thấm mát cuộc đời chờ xuân lên tươi màu cỏ hoa tình yêu đó gắn bó thiết tha ta suốt đời có nhau,tien-chien
Trăng Sơn Cước (Ca Sĩ Ẩn Danh),Thùy Dương, hiện chưa có lời bài hát nào cho trăng sơn cước ca sĩ ẩn danh do ca sĩ thùy dương trình bày bạn có thể click vào đây để đăng lời cho bài hát này,tien-chien
Cảm Ơn Tình Em,Đỗ Minh Hiếu, hiện chưa có lời bài hát nào cho cảm ơn tình em do ca sĩ đỗ minh hiếu trình bày bạn có thể click vào đây để đăng lời cho bài hát này,tien-chien
Từ Lúc Em Đi,Trường Vũ,từ lúc em đi rồi ngoài mái hiên mưa đêm gọi tên người đường hoang vắng đợi hàng cây lớn gọi buồn nghe lá rơi từ lúc em đi rồi hàng ghế công viên xưa chỉ một người chiều qua rất vội người yêu ái ngại nhìn gió mây trôi phố đêm đèn vàng không có em tiếng mưa nhỏ buồn trong trái tim khúc ca thưở nào theo bước đêm hoang nhớ em lạnh lùng căn gác vắng từ lúc em đi rồi từng cánh hoa yêu đương bỏ bên đường bàn tay ngón gầy tìm môi thở dài lời yêu gió bay từ lúc em đi rồi từng cánh chim đêm hỏi tiếng người nhiều khi tiếng cười buồn như rã rời từ lúc em đi 3x,tien-chien
Hà Nội Mùa Vắng Những Cơn Mưa,Lệ Quyên,hà nội mùa này vắng những cơn mưa cái rét đầu đông khăn em bay hiu hiu gió lạnh hoa sữa thôi rơi ta bên nhau một chiều tan lớp đường cổ ngư xưa chầm chậm bước ta về hà nội mùa này chiều không buông nắng phố vắng nghiêng nghiêng cành cây khô quán cóc liêu xiêu một câu thơ hồ tây hồ tây tím mờ hà nội mùa này lòng bao nỗi nhớ ta nhớ đêm nao lạnh đôi tay hơi ấm trao em tuổi thơ ngây tưởng như tưởng như còn đây,tien-chien
Tà Áo Xanh,Lệ Hoa,gió bay từ muôn phía tới đây ngập hồn anh rồi tình lên chơi vơi thuyền anh một lá ra khơi về em phong kín như mây trời đêm đêm ngồi chờ sáng mơ ai mộng nữa cũng là không ta nhau mùa thu ta thương nhau mùa đông ta yêu nhau mùa xuân để rồi tàn theo mùa xuân người về lặng lẽ sao đành anh còn nhớ em nói rằng sao mùa xuân lá vẫn bay sao mùa xuân lá vẫn rơi em ơi có khi nào hoa tàn có trời nào không mây có tình nào không phai em còn nhớ anh nói rằng khi nào em đến với anh xin đừng quên chiếc áo xanh em ơi có đâu ngờ đêm rằm có màu nào không phai như màu xanh ái ân rồi chiều nao xác pháo bên thềm tàn mắt bay em đi trong xác pháo anh đi không nước mắt thôi đành em lúc anh ra đi lạnh giá tâm hồn hoa mai rơi từng cánh bên đường lạnh lùng mà đi luyến tiếc thêm chi hoa tàn nhạc bay theo không gian,tien-chien
Chân Quê,Hương Lan,hôm qua em đi tỉnh về đợi em ở mãi con đê đầu làng khăn nhung quần lĩnh rộn ràng áo cài khuy bấm em làm khổ tôi nào đâu cái yếm lụa sồi cái dây lưng đuỗi nhuộm hồi sang xuân nào đâu cái áo tứ thân cái khăn mỏ quạ cái quần nái đen nói ra sợ mất lòng em van em em hãy giữ nguyên quê mùa như hôm em đi lễ chùa cứ ăn mặc thế cho vừa lòng anh hoa chanh nở giữa vườn chanh thầy u mình với chúng mình chân quê hôm qua em đi tỉnh về hương đồng gió nội bay đi ít nhiều,tien-chien
Em Yêu Màu Lá,Nhật Hạ, hiện chưa có lời bài hát nào cho em yêu màu lá do ca sĩ nhật hạ trình bày bạn có thể click vào đây để đăng lời cho bài hát này,tien-chien
Dư Âm,Tùng Dương,đêm qua mơ dáng em đang ôm đàn dìu muôn tiếng tơ không gian trầm lắng như âu yếm ru ai trong giấc mơ mái tóc nhẹ rung trăng vờn làn gió yêu ai anh nắn cung đàn đầy vơi đôi mắt xa vời anh yêu tiếng hát êm như lời nguyền đẹp bao ước mơ anh như lầu vắng em như ánh trăng reo muôn ý thơ muốn nói cùng em đôi lời trìu mến tim anh băng giá đang ngại ngùng câu năm tháng mong chờ hẹn em từ muôn kiếp trước nhớ em mấy thuở bạc đầu anh đã âu sầu vì đường tơ vương vấn em để cung đàn đưa anh về đâu dư âm tiếng hát reo lên trong lòng anh bao nhớ nhung đê mê lòng nhớ đêm qua giấc mơ môi em hé rung anh muốn thành mây nương nhờ làn gió đưa anh tới cõi mơ hồ nào đây muôn kiếp bên nàng ,tien-chien
Lặng Lẽ Nơi Này,Khánh Ly, tình yêu mật ngọt mật ngọt trên môi tình yêu mật đắng mật đắng trong đời tình yêu như biển biển rộng hai vai biển rộng hai vai tình yêu như biển biển hẹp tay người biển hẹp tay người lạc lối em đi về nơi ấy nơi đâu nơi đâu sông cạn đá mòn trăng treo đầu con sóng tan theo tan theo chút tình xa vắng làm sao ru được tình vơi à ơi nỗi đau này người tình yêu vô tội để lại cho ai buồn như giọt máu trời cao đất rộng một mình tôi đi một mình tôi đi đời như vô tận một mình tôi về một mình tôi về với tôi,tien-chien
Hà Nội Mùa Này Vắng Những Cơn Mưa,Tuấn Ngọc,hà noi mùa vắng những cơn mưa hà nội mùa này vắng những cơn mưa cái rét đầu đông khăn em bay hiu hiu gió lạnh hoa sữa thôi rơi em bên tôi một chiều tan lớp đường cổ ngư xưa chầm chậm bước ta về hà nội mùa này trời không buông nắng phố vắng nghiêng nghiêng cành cây khô quán cóc liêu xiêu một câu thơ hồ tây hồ tây tím mờ hà nội mùa này lòng bao nỗi nhớ ta nhớ đêm nao lạnh đôi tay hơi ấm trao em tuổi thơ ngây tưởng như tưởng như còn đây trương quý hải,tien-chien
Rồi Mai Tôi Đưa Em,Tùng Dương,rồi mai tôi đưa em xa kỷ niệm xin lời cuối không dối gian trong mắt em tình yêu cho thương đau nghe buồn thêm gác vắng mưa gợi niềm chăn chiếu còn đây không gian xưa gót lầy bên hè phố cây lá thưa chim đã bay ngồi nghe yêu thương đi xa tầm tay giữa tiếng ru trầm vào cơn mê này chiều xưa em qua đây ru hồn nắng ngủ say lời yêu trót đong đầy đón em thu mây bay tiễn em xuân chưa phai xót ngày vàng còn gì đành đoạn rồi những lần chiều hẹn ước rồi mai chân hoang vu lên phố gầy tôi về nhớ trong mắt môi đã đắng cay còn ai mơ trên tay khi hoàng hôn vỗ giấc xuân muộn về trên môi hồng,tien-chien
Cô Bắc Kỳ Nho Nhỏ,Tuấn Ngọc,này cô em bắc kỳ nho nhỏ này cô em tóc demi garxong chiều hôm nay xuống đường đón gió cô có tình cờ nhìn thấy anh không này cô em bắc kỳ nho nhỏ vì cô em có nụ cười ngây thơ thành khi không quãng đường im gió không gió lấy gì lang thang cô có thương thầm anh không đời chìm muôn nhánh khổ nguy nan mà anh mang tội gốc chưa tan cửa chùa nào mà không rộng mở quỷ sứ nào chẳng muốn nương thân rồi khi qua giáo đường kiếm chúa đội thánh giá xin làm chiên ngoan thấy có đứa đuôi dài đầu sừng chúa cũng xót thương người lầm than này cô em bắc kỳ nho nhỏ này cô em tóc demi garcon đạp xe vô lối chờ anh ngó quên hết giận hờn thù ghét đám đông này cô em bắc kỳ nho nhỏ này cô em mắt trời bao dung nhìn anh đi hãy nhìn cho rõ trước khi nhìn đám đông trước khi vào đám đông,tien-chien
Chiếc Lá Cuối Cùng,Lệ Thu,đêm qua chưa mà trời sao vội sáng một đàn chim cánh nhỏ chở mùa sang trời vào thu tiễn em sầu lạnh giá lá trên cành từng chiếc cuốn bay xa đêm chia ly buồn gì sao chẳng nói chỉ nghe tim nức nở trở về thôi ngày buồn tênh cũng đưa chiều vào tối mĩm môi cười mà nhớ thương không nguôi mộng về một đêm xuân sang em thì thầm ngày đó thương anh thuyền về một đêm trăng thanh say mộng vàng đậu bến sông xanh mộng tràn ngập đêm trăng sao sao đầy trời từng chiếc lấp lánh rồi một chiều xuân thơ trinh cho lòng mình về với dĩ vãng xa nhau chưa mà lòng nghe quạnh vắng đường thênh thang gió lộng một mình ta rượu cạn ly uống say lòng còn giá lá trên cành một chiếc cuối bay xa,tien-chien
Nhớ Anh Nơi Đảo Xa,Diệu Hiền, hiện chưa có lời bài hát nào cho nhớ anh nơi đảo xa do ca sĩ diệu hiền trình bày bạn có thể click vào đây để đăng lời cho bài hát này,tien-chien
Em Vẫn Tin,Nhật Hạ, hiện chưa có lời bài hát nào cho em vẫn tin do ca sĩ nhật hạ trình bày bạn có thể click vào đây để đăng lời cho bài hát này,tien-chien
