title,singer,lyric,genre
Tân Cổ (Còn Thương Rau Đắng Mọc Sau Hè),"Ngọc Huyền, Tường Nguyên",tân nhạc nắng hạ đi mây trôi lang thang cho hạ buồn coi khói đốt đồng để ngậm ngùi chim nhớ lá rừng ai biết mẹ buồn vui khi mẹ kêu cậu tới gần biểu cậu ngồi mẹ nhổ tóc sâu hai chị em tóc bạc như nhau đôi mắt cậu buồn hiu phiêu lưu rong chơi những ngày đầu chừa ba vá muỗng dừa đường mòn xưa dãi nắng mưa ai cách xa cội nguồn ngồi một mình nhớ lũy tre xanh dạo quanh khung trời kỉ niệm chợt thèm rau đắng nấu canh xin được làm mây mà bay khắp nơi giang hồ ghé chốn quê hương xa rời từ cất bước ly hương xin được làm gió dập dìu đưa điệu ca dao chái bếp hiên sau cũng ngọt ngào một lời cho nhau xin sống lại tình yêu đơn sơ rong chơi những ngày đầu chừa ba vá muỗng dừa đường mòn xưa dãi nắng mưa xin nắng hạ thôi buồn để mình ngồi nhớ lũy tre xanh dạo quanh khung trời kỉ niệm chợt thèm rau đắng nấu canh vọng cổ nhớ thuở ấu thơ bên chiếc võng đưa tiếng mẹ ru con hòa với tiếng gió lùa tiếng tre kẽo kẹt nay trở lại làng xưa tìm đâu bóng mẹ và tiếng cậu khẽ rầy yêu các con đừng ham chơi lo ăn học nên người hơn hai mươi năm chúng con lưu lạc bốn phương trời trên đường về quê hương đây mái tranh kia con đò bên sông đường xưa vẫn luôn in đầy bao kỉ niệm một thời thơ ấu ngày mẹ già đưa tiễn con trên bến sông trời buồn mưa dông mắt mẹ nhòa hòa với mưa lệ sa như giấu sâu trong lòng nỗi niềm nhớ con ngày qua ngày từng ngày trôi qua con đã lớn khôn với bao hồi ức xưa không thể nào quên lãng ngày mưa tuyết lạnh nơi xứ người đất khách con thèm cơm mẹ nấu canh rau đắng cá rô đồng tiếng tiếng mưa rơi đều quê chiều xưa dáng yêu mẹ hiền đang chờ con mỗi khi tan trường trên đường đê khi trời đổ mưa tiếng tiếng hát xưa muôn đời lời mẹ ru thuở con dại khờ ngày nay chúng con nên người quay về đây tìm lại chốn xưa còn đâu bóng mẹ hiền dấu yêu cây khế ngày xưa mẹ ngồi nhổ tóc sâu cho cậu bên cạnh gốc me chua chúng con đùa giỡn sau hè gió thổi mưa sa con sông quê êm đềm nước chảy một tấm thân gầy mẹ nuôi nấng đàn con mẹ ơi canh rau đắng cá rô đồng nồi cơm mẹ nấu vẫn nhớ hoài trong con tân nhạc xin nắng hạ thôi buồn để mình ngồi nhớ lũy tre xanh dạo quanh khung trời kỉ niệm chợt thèm rau đắng nấu canh,tien-chien
Nỗi Buồn Dâng Hiến,Lê Uyên & Phương,khi em bước đến bên tôi lời chim tưng bừng hoa môi sớm nở ân tình buồn nhiều vẫn riêng mình dâng cho em lời yêu thương thương bao nhiêu lần còn in trên nét môi em ơi thôi buồn làm chi như nắng phai đâu những ân tình xưa ấy nếu trăng có thấy buồn vì thương nếu sao còn đếm thầm thời gian mong ngày mai đừng xa mờ đời em đường thiên lý mong chờ bàn tay dâng hiến tuổi xuân dắt dìu tâm hồn vào đời sương còn rơi mờ trong lòng màu môi còn tô sắc mây chiều đàn ơi nâng đến phím nào dĩ vãng màu xanh trong thân yêu tìm đâu những ngày xưa mưa nắng sớm chiều buồn vì ngày mai không tương lai buồn vì tình yêu mau phôi phai tháng ngày mưa ơi nếu có xuôi nguồn đừng mang thêm buồn thương cho kiếp sống tha phương rạt rào xót xa nhiều em mơ cuộc đời thêu hoa ôm tâm tư buồn bàn tay như giáng tiên sông tương ơi còn vì tương lai gió sương đâu những linh hồn xưa ấy biết bao giờ hết buồn vì thương biết bao giờ thấy màu thời gian tương lai mịt mờ mãi mãi tương lai mịt mờ mãi mãi vì đâu,tien-chien
Giọt Lệ Cho Ngàn Sau,Thanh Lan, hiện chưa có lời bài hát nào cho giọt lệ cho ngàn sau do ca sĩ thanh lan trình bày bạn có thể click vào đây để đăng lời cho bài hát này,tien-chien
Chuyện Tình Sơn Nữ,Ái Vân, hiện chưa có lời bài hát nào cho chuyện tình sơn nữ do ca sĩ ái vân trình bày bạn có thể click vào đây để đăng lời cho bài hát này,tien-chien
Nước Mắt Quê Hương,Thái Châu, hiện chưa có lời bài hát nào cho nước mắt quê hương do ca sĩ thái châu trình bày bạn có thể click vào đây để đăng lời cho bài hát này,tien-chien
Ai Xuôi Vạn Lý,Ánh Tuyết,nơi phía nam giữa núi mờ ai bế con mãi đứng chờ như nước non xưa đến giờ đường chiều mịt mù cát bay tỏa bước ngựa phi đường trường nếp tàn y hùng cường vẫn còn bay trong gió bóng từ xa sắp dần qua bóng chàng chập chùng vượt núi non cũ với hành lương độ đường chiếc hùng gươm danh tướng dưới tà uy đếm nhịp đi vó ngựa phi dấn bước tang bồng giữa nơi núi rừng bên nợ tình thâm bên nợ giang san bên đồi ai oán bên rừng đa đoan đón đưa bóng chàng đường về nước chập chùng xa nhiều đồi núi cheo leo cây với rừng rườm rà đường vạn xuyên đường cổ lũy duyên núi sông vẫn như thắm hòa đò vạn lý đò ải quan đò rừng lá nước trong bao cá lội từng đàn thành cổ loa đền vạn kiếp bao tháng năm dấu chưa xóa nhòa tiếng núi non lưu luyến tấc lòng bao nghìn năm tiếng gió cồn như tiếng trống dồn buổi khuya vắng từ bóng cây ngôi mộ bên đường từ mái tranh bên đình trong làng nguồn sử xanh âm thầm vẫn sống bao mối thương vang động trong lòng đồi lan đồi quế rắc kho hương nồng rừng sao đua đòi rừng trắc lo che ánh lửa vầng dương tiếp đưa bóng chàng đường cao đường thấp khắp khe chân chàng nhìn qua con đường mòn cũ quanh co mấy buổi tà dương mới mong tới làng nhớ cố hương xao xuyến tấc lòng mau dồn chân vết bước đi trên phím đá mòn còn in dấu từ bóng cây ngôi mộ bên đường từ mái tranh bên đỉnh trong làng nguồn sử xanh âm thầm vẫn sống bao mối thương vang dậy trong lòng bao tích xưa hoen giữa đời nhưng ước mong xuyên kiếp người đường rừng gập ghềnh dấu binh lửa chiếu hào quang đục ngàu thúc người trong lời gào dẫn đoàn quân trăm chiến mấy ngàn binh tới ngoài biên thoát vòng ngục tù gọi nước non cũ tiến về nam miệt mài vẫn từ xưa hăng hái súng lòng vang dưới cờ bay lấp trời mây núi đá kinh hoàng nhắc câu sấm thề hỡi người chinh phu anh hùng non sông trao người con quý cho người trông nom thiếp xin lỗi thề chàng rảo bước ngoài sườn non tìm người đứng cô đơn đang ngóng đợi chồng về vượt hoành sơn vòng thành lũy mong tới nơi cô thôn bước về từ dải đất miền đồng hoang lời hẹn ước tương lai đang chúc mừng chàng về chờ nhìn con chờ người đón bao nét xưa ước mong sẽ còn núi đá thu reo ước mơ bao nghìn xưa thấy đứa con xanh ngắt nỗi hùng còn trong đó cầm chiếc gươm chinh phụ di truyền chàng bế con trao lại gươm bền rồi chỉ vào sơn hà biến cố trao nó đi gây lại cơ đồ thời gian đã thắm biết bao suy tàn người xưa đâu còn hình đá bơ vơ đứng đợi chồng đi đã không hứa về lòng son lụn chí trước cơn mưa về đã xuôi tan tành đời đá nên mưa gió đổ quạnh hiu xuống ai mới về chiếc báu gươm chinh khách biết trao cho thằng con chí khí cao đã nối mãi còn tài non nước chàng đã ghi trong sử xanh đời một mối duyên trung vạn kiếp người từ nghìn sau biến đổi với đá dân chúng đem ca tụng duyên bà người vọng phu người vọng phu cho đến ngàn đời cho đến ngàn đời người người vẫn nhớ nhớ hòn vọng phu,tien-chien
Tiếng Sáo Chiều Quê,Trường Thanh, hiện chưa có lời bài hát nào cho tiếng sáo chiều quê do ca sĩ trường thanh trình bày bạn có thể click vào đây để đăng lời cho bài hát này,tien-chien
Giọt Mưa Thu,Thanh Nga, hiện chưa có lời bài hát nào cho giọt mưa thu do ca sĩ thanh nga trình bày bạn có thể click vào đây để đăng lời cho bài hát này,tien-chien
Thuyền Viễn Xứ,Thanh Nga, hiện chưa có lời bài hát nào cho thuyền viễn xứ do ca sĩ thanh nga trình bày bạn có thể click vào đây để đăng lời cho bài hát này,tien-chien
Lửa Trại Đêm Nay,V.A,lửa trại đêm nay lung linh soi sáng bao gương mặt tươi sáng lửa trại đêm nay xôn xao chia ấm cho bao tâm hồn nồng nàng lửa trại đên nay không soi cho những ai đem lòng u tối lửa trại đêm nay lao xao thiêu đốt bao u mê đời thường ngồi lại bên nhau anh em ta hát lên cho đời tươi thắm ngồi lại bên nhau anh em ta vững tin cho lửa bập bùng rồi ngày mai khi xa nhau ta có thêm hơi lửa nung nấu để rồi mai khi ta chia tai ta có thêm ánh lửa đêm nay,tien-chien
Áo Bà Ba,Khánh Duy,trời thanh thanh nắng tươi êm đềm hồ gươm vui sắc hoa xanh thắm ngày ánh nắng áo tím áo xanh thoáng qua thoáng qua thoáng qua kìa áo bà ba tôi nhớ ai bên dòng nước xanh người áo trắng đi bên hàng dừa người yêu tôi mong chờ người xinh xinh dáng đi nhẹ nhàng nhìn xa xa phất phơ treo áo nhìn chiếc áo trước gió phất phơ giống in giống in giống in hình dáng người yêu tôi nhớ ai bên dòng nước xanh người áo trắng đi bên hàng dừa người yêu tôi mong chờ người đi xa mắt tôi không dời còn trông theo phất phơ chiếc áo nhìn áo trắng tôi nhớ thương ai nhớ thương nhớ thương nhớ thương người ở việt nam tôi nhớ ai bên dòng nước xanh người áo trắng đi bên hàng dừa người yêu tôi mong chờ trời thanh thanh nắng tươi êm đềm hồ gươm vui sắc hoa xanh thắm ngời ánh nắng áo tím áo xanh thoáng qua thoáng qua thoáng qua kìa áo bà ba tôi nhớ ai bên dòng nước xanh người áo trắng đi bên hàng dừa người yêu tôi mong chờ người yêu tôi mong chờ người yêu tôi mong chờ người yêu tôi mong chờ thu gọn,tien-chien
Nếu Một Mai Em Sẽ Qua Đời,Nguyên Thảo,hoa phủ đầy người xe nhịp đằm khơị xa xôị nếu một mai em đốt pháo vui hát theo người hương cưới chia phôi cười mặn tình đờị nếu một đêm em bước qua thềm mang nặng hồn mềm em trở mình trên nhân duyên nếu nửa đêm trăng gió đã lên bão mưa êm chăn gối ghi tên bia mộ đường quên nếu một mai không còn ai ðứng bên kia đời trông vời vợi không còn ai ðâu còn ai trong ngày mai có dư hương người chỉ là gian dối mà thôị nếu về sau em có qua cầu không chẳng vì sầu thương chẳng còn đâu mà nói chuyện quên nhau nếu vì sao quay gót cuốn mau dấu chân sâu in vết không lâu chẳng nợ gì nhaụ,tien-chien
Mờ Màng,Mai Hương, hiện chưa có lời bài hát nào cho mờ màng do ca sĩ mai hương trình bày bạn có thể click vào đây để đăng lời cho bài hát này,tien-chien
Bốn Màu Áo (Pre 75),Mai Lệ Huyền,một lần anh đến thăm em lúc gió mưa rơi đầy ngoài thềm lúc chúng ta hy vọng thật nhiều nên áo em đẹp màu xanh rồi một lần ước mơ mai sau lúc pháo yêu đương nhuộm màu hường lúc đón cô dâu về nhà chồng cho áo em hồng tình yêu có những lúc nghe bơ vơ hẹn không đến cho em đợi chờ giận anh thường hay quên khoác áo tím em đi trong mưa đừng mặc màu áo tím anh không ưa mình giận nhau đã ba hôm nay biết nhớ biết thương nhau thật là nhiều em khoác áo hoa vàng lần hẹn đầu hai đứa qua cầu gặp nhaụ,tien-chien
Bay Đi Cánh Chim Biển,Thanh Lan, hiện chưa có lời bài hát nào cho bay đi cánh chim biển do ca sĩ thanh lan trình bày bạn có thể click vào đây để đăng lời cho bài hát này,tien-chien
Hà Nội Ơi Một Trái Tim Hồng,Ái Vân,tôi hát bài ca ngợi ca hà nội ôi thủ đô xao xuyến trong trái tim tôi hàng cây xanh bao mùa lá đỏ gió sông hồng rì rào sóng vỗ mùa thu đi qua từng phố nhỏ ôi hồ gươm như một bài thơ hà nội ơi có từ bao giờ mấy nghìn năm chói chang rạng rỡ hà nội ơi náo nức bài ca vẫn âm vang trong tâm hồn ta người hà nội hôm nay ra đi mang theo mình bao nhiêu nỗi nhớ những ánh đèn qua ô cửa sổ bầu trời đêm cháy bỏng tình yêu một chàng trai là chiến sĩ biên phòng một cô gái lên đường đi xa vẫn thủy chung với cả tấm lòng,tien-chien
Mai Đây Hòa Bình,Sơn Ca, hiện chưa có lời bài hát nào cho mai đây hòa bình do ca sĩ sơn ca trình bày bạn có thể click vào đây để đăng lời cho bài hát này,tien-chien
Cô Lái Đò,Đức Long,xuân đã đem mong nhớ trở về lòng cô lái ở bến sông kia cô hồi tưởng lại ba xuân trước trên bến cùng ai đã lặng thề nhưng rồi người khách tình quân ấy đi biệt không về với với bên sông đã mấy lần xuân trôi trôi mãi mấy lần cô lái mòn mỏi chờ xuân này đến nữa đã ba xuân đốm lửa tình duyên tắt nguội dần chẳng lẽ ôm lòng chờ đợi mãi cô đành bội ước với tình quân bỏ thuyền bỏ bến bỏ dòng sông cô lái đò kia đi lấy chồng vắng bóng cô em từ dạo ấy để buồn cho những khách sang sông,tien-chien
Nỗi Lòng,Đức Long,yêu ai yêu cả một đời tình những quá khắt khe khiến cho đời ta đau tủi cả lòng vì yêu ai mà lòng hằng nhớ năm tháng trôi lạnh lùng hoài tình đó nhắc nhở luôn đến ta tình ái nhớ cả một trời tình yêu kia mà lòng nào quên lòng vẫn biết nếu yêu rồi một ngày là đến với đớn đau nhưng sao trong ta cứ vẫn yêu vẫn nhớ dầu sao dầu sao nếu có một ngày một ngày ai gieo tim ta là tình yêu kia ly tan mà lòng vẫn thương vẫn nhớ tình đó khiến sui lòng ta đau rồi với bao ngày lặng lẽ sống nỗi đau trong lòng người yêu vẫn yêu hoài yêu ai ai hiểu được lòng thầm kín những đớn đau với riêng lòng ta ấp ủ lạnh lùng tình yêu kia mà người nào hay,tien-chien
Xin Rửa Tội Tôi,Tuấn Ngọc,ta bia mộ lãng quên níu gì thời đã mất mở tung ta gió ngất lưng trời cho cháy rực nỗi đìu hiu ta đi trên đường gai dù chúa không hề trải cảnh đời thôi cũng xế tàn nào ai không trở về ta ngồi mòn ghế cũ nghe mưa trên từng ngọn cây muộn phiền cò bủa vây quanh sau lưng ta lá a à bầy xin rửa tội tôi xin rửa tội tôi bằng lửa cho kẻ chết là ta đến một ngày mai đến một ngày mai sống lại trong tay người mãi xa,tien-chien
Vạn Thọ,Giao Linh,vạn thọ giao linh em ơi nếu yêu nhau chớ để buồn lòng mai sau em ơi dẩu xa xôi ko có nghỉa mình chia phôi làm sao quên chiều trong kỷ niệm tìm về đôi mắt em làm sao quên mùa hoa năm đó mùa hoa vạn thọ mùa hoa chúc lành khi em tiển đưa vạn thọ cho anh vạn thọ cho em em ơi vắng anh lâu em buồn rầu nhiều ko em em ơi nhớ thương em anh củng buồn nhiều như em và hôm nay mùa hoa vạn thọ lại về trên núi sông mùa anh đi mùa anh xin cưới mùa anh hẹn thề tình yêu đả nở hoa trong chiến chinh vạn thọ vô cương vạn thọ yêu đương đk tháng tháng anh đi trên bốn vùng quê hương hàn gắn lại đau thương nhưng anh ko chết trong khói lửa mà em chết trong tuổi nhỏ hậu phương mấy lúc xông pha trong khói lửa chông gai là nghỉ về tương lai nhưng anh ko khổ trong khói lửa mà khổ vì nổi buồn mình biệt ly sương rơi trắng không gian mang một màu buồn khăn tang em ơi nhớ thương anh củng buồn nhiều như em làm sao quên từng đêm kỷ niệm mình dìu nhau ái ân người yêu ơi làm sao anh biết mùa hoa vạn thọ mùa hoa cuối cùng khi em tiển anh vạn thọ cho em vạn thọ cho anh ,tien-chien
Chuyện Một Đêm,Tam Ca 3A, hiện chưa có lời bài hát nào cho chuyện một đêm do ca sĩ tam ca 3a trình bày bạn có thể click vào đây để đăng lời cho bài hát này,tien-chien
Hai Sắc Hoa Tigôn,Hồng Vân (NSND),hai sắc hoa tigôn ttkh một mùa thu trước mỗi hoàng hôn nhặt cánh hoa rơi cảm thấy buồn nhuộm ánh nắng tà qua mái tóc tôi chờ người đến với yêu đương người ấy thường hay ngắm lạnh lùng dải đường xa vút bóng chiều phong và phương trời thẳm mờ sương cát tay vít dây hoa trắng chạnh lòng người ấy thuờng hay vuốt tóc tôi thở dài trong lúc thấy tôi vui anh sợ tình ta cũng thế thôi thuở ấy nào tôi đã hiểu gì cánh hoa tan tác của sinh ly là chút lòng trong chẳng biến suy đâu biết một đi một lỡ làng dưới trời đau khổ chết yêu đương người xa xăm quá tồi buồn lắm trong một ngày vui pháo nhuộm đường từ đấy thu rồi thu lại thụ lòng tôi còn giá đến bao giờ chồng tôi vẫn biết tôi thương nhớ người ấy cho nên vẫn hững hờ tôi vẫn đi bên cạnh cuộc đời ái ân lạt lẽo của chồng tôi mà từng thu chết từng thu chết vẫn giấu trong tim bóng một người buồn quá hôm nay xem tiểu thuyết thấy ai cũng ví cánh hoa xưa nhưng hồng tựa trái tim tan vỡ và đỏ như màu máu thắm pha tôi nhớ lời người đã bảo tôi một muà thu trước rất xa xôị đến nay tôi hiểu thì tôi đã làm lỡ tình duyên cũ mất rồi tôi sợ chiều thu nhạt nắng mờ chiều thu hoa đỏ rụng chiều thu gió về lạnh lẽo chân mây vắng người ấy sang sông đứng ngó đò nếu biết rằng tôi đã lấy chồng trời ơi người ấy có buồn không có thầm nghĩ tới loài hoa vỡ tựa trái tim phai tựa máu hồng,tien-chien
Se Chỉ Luồn Kim,V.A,xe chỉ ố mấy kim bên luồn kim ố mấy kim bên luồn kim rồi ngồi rồi xe chỉ ố mấy kim bên luồn kim ố mấy kim bên luồn kim thêu vào tình chung là buông nhiễu tím í í a gửi ra gửi ra gửi cho người u sáng u sáng u cái lư diêu phạt cái lội gửi ra gửi cho người,tien-chien
Đò Tình Lỡ Chuyến (Pre 75),Thanh Tuyền,đò tình lỡ chuyến anh đi lính em cũng vừa lên mười anh về phép em thường sang nhà chơi em bá cổ đòi quà anh xin lỗi lỡ quên rồi xin khất nhé bé ơi trăng non khuyết trăng đến rằm cũng tròn em càng lớn trông càng xinh đẹp hơn không nũng nịu vòi quà anh xin nữa má em hồng nghe nhắc chuyện ngày xưa thế rồi con sáo sang sông thế rồi bé đi lấy chồng lời yêu anh chưa kịp ngỏ biết trách ai đây rượu tình pha men cay duyên sẽ lỡ em đã về tay người bên chồng mới quên dần bóng hình ai vui bến mong thuyền tình em nên chuyến chốn giang đầu tôi lỡ con đò duyên,tien-chien
Lỗi Hẹn (Pre 75),Thanh Tuyền, hiện chưa có lời bài hát nào cho lỗi hẹn pre 75 do ca sĩ thanh tuyền trình bày bạn có thể click vào đây để đăng lời cho bài hát này,tien-chien
Em Đi Qua Cầu Cây,Cẩm Ly,có chiếc cầu cây bắc ngang qua suối cao thật cao không tay vịn em đi qua chiếc cầu rung rinh dòng nước lung linh soi bóng em đi cầu tre lắc lẻo chân em vững vàng dòng nước trôi nhanh em vui mắt nhìn có ai nào ngờ em qua cầu hay chính em là người thanh niên xung phong những tháng ngày qua sống trong gian khổ đi đào kinh em không ngại trong mưa tuôn dưới màn sương đêm dù nắng chang chang em vẫn hiên ngang từ trong gian khó nay em trưởng thành nào xá hiểm nguy em ra chiến trường hiến dâng cuộc đời em cho tổ quốc áo xanh bạc màu thanh niên xung phong,tien-chien
Chắc Không Bao Giờ (Pre 75),Giao Linh, hiện chưa có lời bài hát nào cho chắc không bao giờ pre 75 do ca sĩ giao linh trình bày bạn có thể click vào đây để đăng lời cho bài hát này,tien-chien
Lỡ Bước Sang Ngang 2,Hồng Vân (NSND),trời mưa ướt áo làm gì năm mười bảy tuổi chị đi lấy chồng người ta pháo đỏ rượu hồng mà trên hồn chị một vòng hoa tang lần đầu chị bước sang ngang tuổi son sông nước đò giang chưa tường ở nhà em nhớ mẹ thương ba gian trống một mảnh vườn xác xơ mẹ ngồi bên cửi xe tơ chị bây giờ nói thế nào bướm tiên khi đã lạc vào vườn hoang chị từ lỡ bước sang ngang trời dông bão giữa tràng giang lật thuyền xuôi dòng nước chảy liên miên đưa thân thế chị tới miền đau thương mười năm gối hận bên giường mười năm nước mắt bữa thường thay canh mười năm đưa đám một mình đào sâu chôn chặt mối tình đầu tiên mười năm lòng lạnh như tiền tim đi hết máu mà duyên không về nhưng em ơi một đêm hè hoa xoan nở xác con ve hoàn hồn dừng chân trên bến sông buồn nhà nghệ sĩ tưởng đò còn chuyến sang đoái thương thân chị lỡ làng đoái thương phận chị dở dang những ngày rồi rồi chị nói sao đây em ơi nói nhỏ câu này với em thế rồi máu trở về tim duyên làm lành chị duyên tìm về môi chị nay lòng ấm lại rồi mối tình chết đã có người hồi sinh chị từ dan díu với tình đời tươi như buổi bình minh nạm vàng tim ai khắc một chữ nàng mà tim chị một chữ chàng khắc theo nhưng yêu chỉ để mà yêu chị còn ước một điều gì hơn một lầm hai lỡ keo sơn mong gì gắn lại phím đờn ngang cung rồi đêm kia lệ ròng ròng tiễn đưa người ấy sang sông chị về tháng ngày qua cửa buồng the chị ngồi nhặt cánh hoa lê cuối mùa ,tien-chien
Mộ Đời,Quốc Khanh,rồi sẽ có một ngày sẽ có một lần ta đưa ta về phiá chân trời có mưa từng chợt buồn và có gió heo mây và có chút men cay rồi sẽ có một ngày sẽ có một lần nhạt nhoà trên môi em kỷ niệm ái ân còn trái tim ta rơi ngoài mái tóc rơi ngoài mái tóc buồn cát tội buồn cho định mệnh trầm luân để em vui để em quên mà xa ta lặng câm chưa hề bao giờ ta tự hỏi lòng sẽ tìm được gì vui trong cuộc sống nhưng sẻ chỉ vì trái tim sẻ chỉ vì trái tim mà sống hoài đợi mong rồi sẽ có một ngày sẽ có một lần đêm hoang vu ta bước chân về bước chân thật nặng nề bài hát của ta nghe bằng tiếng hát phôi pha lệ rưng rưng trên mắt người hôm qua có bóng em lung linh quanh phím ngà em xa ta mà vóc dáng kiêu xa ta cúi đầu đi về mộ đời ta,tien-chien
Đưa Em Tìm Động Hoa Vàng,Hoàng Thục Linh, hiện chưa có lời bài hát nào cho đưa em tìm động hoa vàng do ca sĩ hoàng thục linh trình bày bạn có thể click vào đây để đăng lời cho bài hát này,tien-chien
