title,singer,lyric,genre
Du Kích Long Phú (1949),Cao Minh,ai vượt cửu long giang vững trí lướt sóng ngàn có đoàn quân du kích đón đưa được an toàn quân giặt tuy hung hăng nhưng nào thắng anh hùng vững chèo khi tách bến lướt dòng sông cửu long chúng ta đoàn quân du lích sống cùng long phú mến yêu đồng bào tin yêu du kích giữ chặt long phú mến yêu ai về cù lao dung nhớ nghé viếng rạch già nhớ về an thanh nhứt hỏi tây chết mấy thằng cánh cồn nay sơ xác dân cồn vẫn tươi cười đất lưu luyến mãi bóng người du kích quân chúng ta đoàn quân du lích sống cùng long phú mến yêu đồng bào tin yêu du kích giữ chặt long phú mến yêu đây ruộng đồng bao la bát ngát đến xa vời lúa cùng quân du kích thiết tha như bóng hình mỗi mùa khi lúa chín ta về giữ lúa vàng những bàn tay xinh xắn cắt về nuôi chúng ta chúng ta đoàn quân du lích sống cùng long phú mến yêu đồng bào tin yêu du kích giữ chặt long phú mến yêu giết giặc dù gian nan nắng dãi với mưa dầu bót giặc vây xung quanh vẫn hiên ngang tung hoành ta còn sông cửu long lúa còn bát ngát ngát đồng ta còn cầm gươm súng giết loài tây dã man chúng ta đoàn quân du lích sống cùng long phú mến yêu đồng bào tin yêu du kích giữ chặt long phú mến yêu chúng ta từng gian lao sống chết với đồng bào trước giặt không nao núng quyết tâm giữ xóm làng đây là nơi quê quán chan hòa mối thâm tình kết lại bằng xương máu giữa đồng bào với ta chúng ta đoàn quân du lích sống cùng long phú mến yêu đồng bào tin yêu du kích giữ chặt long phú mến yêu,tien-chien
Em Đứng Giữa Giảng Đường,Bích Liên (NSƯT), hiện chưa có lời bài hát nào cho em đứng giữa giảng đường do ca sĩ bích liên nsưt trình bày bạn có thể click vào đây để đăng lời cho bài hát này,tien-chien
Chỉ Còn Là Kỷ Niệm,Hoàng Lan,em vừa nghe lời văng vắng trong đêm phải chăng lời ngày đó đang về tim nhắc cho em một thời đầm ấm lúc tung tăng chiều hè ngặp nắng lúc trăng lên bên thềm đôi má kề khi hoàng hôn về vây kín không gian mới hay rằng hạnh phúc đang vỡ tan tiếc thương cho lời nồng ngày đó sớm theo anh gọi người đầu ngõ bước chân đi làm nát duyên ban đầu anh mang theo giấc mơ trong đời vòng tay yêu không rời một niềm tin vừa tới phải không anh tình vui khi đắm say đời em sao chẳng may mới tìm vào một lần mà tình đã cao bay con đường yêu nhiều giông tố hôm qua đã hoang tàn vì vắng chân người xa bóng cô đơn tràn vào ngõ tối tiếng mưa đêm hòa lệ tình cuối cố nhân ơi lòng chết khi xa người ,tien-chien
Hát Mừng Chiến Sĩ Điện Biên,V.A, hiện chưa có lời bài hát nào cho hát mừng chiến sĩ điện biên do ca sĩ va trình bày bạn có thể click vào đây để đăng lời cho bài hát này,tien-chien
Đoàn Lữ Nhạc,Vũ Phong Vũ,ra đi khắp nơi xa vời gió bốn phương kìa gió bốn phương ào ào cuốn lá rơi người đi khúc nhạc chơi vơi gió khắp nơi kìa gió khắp trời vang vang khúc nhạc say đời a ha a ha hỡi dấu vết xưa tàn phá đâu đâu ai biết lũ chim về đâu a ha a ha cất tiếng hát lên cười phá ôi ôi kìa có bóng chim hải hồ a a a khi ta ra đi cây đàn mang theo trên hai vai cất tiếng hát rung trời mây hát tiếng gió ru ngàn cây giờ bước chân đi khói lửa bập bùng đây đó đó đó hỡi lữ khách quên đây cất tiếng hát quên sầu bi đi là đi là đi là đi là đi lên chót vót góc núi reo hò reo hò reo hò reo hò reo ta đứng đón gió mới đi là đi là đi là đi là đi khi sóng gió cuốn tới ôi ôi ôi giang hồ hồn ta dâng cao chơi vơi ra đi khắp nơi xa vời gió bốn phương kìa gió bốn phương ào ào cuốn lá rơi người đi khúc nhạc chơi vơi gió khắp nơi kìa gió khắp trời vang vang khúc nhạc say đời a ha a ha hỡi dấu vết xưa tàn phá đâu đâu ai biết lũ chim về đâu a ha a ha cất tiếng hát lên cười phá ôi ôi kìa có bóng chim hải hồ a ha ha,tien-chien
Người Giỏi Chăn Nuôi,Vân Khánh, hiện chưa có lời bài hát nào cho người giỏi chăn nuôi do ca sĩ vân khánh trình bày bạn có thể click vào đây để đăng lời cho bài hát này,tien-chien
Hướng Về Hà Nội,Quốc Tuấn,hà nội ơi hướng về thành phố xa xôi ánh đèn giăng mắt muôn nơi áo màu tung gió chơi vơi hà nội ơi phố phường dài ánh trăng mơ liễu mềm nhủ gió ngây thơ thấu chăng lòng khách bơ vơ hà nội ơi những ngày vui đã ra đi biết người còn nhớ nhung chi hết rồi giây phút phân ly hà nội ơi dáng huyền tha thiết đê mê tóc thề thả gió lê thê biết đâu ngày ấy anh về một ngày mùa chinh chiến ấy chim đã xa bầy mịt mờ bên trời bay một ngày tả tơi hoa lá ngóng trông về xa luyến thương hình bóng qua hà nội ơi nước hồ là ánh gương soi nắng hè tô thắm lên môi thanh bình tiếng cuốc reo vui hà nội ơi kiếp đời muôn hướng buông trôi nhớ về người những đêm rơi nhắn theo ngàn cánh chim trời hà nội ơi những ngày thơ ấu trôi qua mái trường phượng vĩ dâng hoa dáng chiều rủ bóng thiên nga hà nội ơi mắt huyền ngây ngất đê mê tóc thề thả gió lê thê hãy tin ngày ấy anh về một ngày tàn hương chinh chiến tìm khói lăng chìm tìm về nơi bờ bến một ngày hồng tươi hoa lá hát lên lời ca nói lên lời thiết tha hà nội ơi biết người còn có trông mong hướng về ai nữa hay không những ngày xa vắng bên sông hà nôi ơi những chiều sương gió dâng khơi có người lặng ngắm mây trôi biết bao là nhớ tơi bời x2,tien-chien
Lý Quạ Kêu (Pre 75),Thanh Tuyền, hiện chưa có lời bài hát nào cho lý quạ kêu pre 75 do ca sĩ thanh tuyền trình bày bạn có thể click vào đây để đăng lời cho bài hát này,tien-chien
Một Ngày Không Có Em (Pre 75),Anh Khoa,một ngày không có em là lòng anh tan nát cả trời mây u ám thời gian vẫn âm thầm âm thầm hằn trên bia đá xanh một ngày không có em là lòng anh se thắt cả ngàn cây im tiếng chịu tang khóc mối tình mối tình như nghĩa trang lạnh lùng đường mây lối gió ai người hay tình yêu chấp cánh ra biển khơi trời cao man mác xanh nghìn đời bụi hồng lấm gót kiếp thương vay mưa không lạnh mà sao hồn băng giá một ngày không có em tuổi hồng thành vô nghĩa tình chờ còn chưa mất tình yêu đã tan tành tan tành tựa sương khói chiều hoang,tien-chien
Lời Hứa Ban Đầu (Pre 75),Anh Khoa,người đi còn nhớ chiều tiễn đưa giờ đây xin nhớ trở về xa xưa ai kết áo em cánh hoa hồng đầu tiên cho em thêm ưu phiền tình yêu anh cho em từ đó mong sao cho trời sáng anh sẽ về thăm em giờ đây còn nhớ gì hỡi em ngày xưa em hứa trọn đời yêu anh như bướm với hoa không khi nào lìa xa yêu thương thêm đậm đà đời hoa không khi nào lạc bến không mang tên loài bướm anh sẽ về thăm em anh hứa mai này quê hương tàn lửa khói hai đứa mình chung đôi nhưng quê hương chưa thanh bình xin em ghi trong lòng đừng giận hờn vu vơ em ước mong rằng đêm đêm khi trời tối em đến gần bên anh đem cho anh bao ân tình cho quê hương thanh bình mộng đẹp của chúng mình cầu xin hạnh phúc đẹp lứa đôi để cho em gái đẹp tựa trăng soi mong ước mai sau nước non mình đẹp tươi hai ta xây mộng đầu thì xin ơn trên ban lời nói yêu thương không lừa dối hai đứa mình đẹp đôi,tien-chien
Quen Nhau Những Dấu Yêu,Ngọc Lan, hiện chưa có lời bài hát nào cho quen nhau những dấu yêu do ca sĩ ngọc lan trình bày bạn có thể click vào đây để đăng lời cho bài hát này,tien-chien
Câu Đêm,"Hoài Linh, Cát Phượng",anh buông luỡi câu câu hoài mà câu ở đâu hay là ham thả dây thăm dò ao nào nông sâu nông sâu cần câu anh làm dấu đêm nay mù sương em nào thấu muỗi vo ve kêu cá chưa mê mồi anh ngồi câu nó mới lâu nè anh câu mồi chi ao nào mà câu được nhiêu vậy ao trong bèo che hay là ao ở ngoài rong rêu rong rêu làm cho ao nhiều cá nên anh ngồi câu luôn được khá có đêm vô trê cắn câu cong cần ao nhờ rong rêu anh buông luỡi câu không ngại công cho em niềm vui ra chợ đông bù đêm chờ mong phòng không em một bóng anh buông luỡi câu ngon thật ngon cho em bờ môi thêm màu son nồi kho nhiều hơn bù đêm mõi mòn anh buông lưỡi câu coi chừng cần câu nó gãy đôi đó đi câu thì câu xin đừng câu nhằm cái lôi thôi đó nha yên tâm đi mình ơi em đừng nhắc siêng năng nghề câu anh cầm chắc nhớ danh ngôn xưa có câu tay làm cho hàm nhai thôi nè bà xã àh,tien-chien
Thuyền Và Biển,Hồng Vân (NSND), hiện chưa có lời bài hát nào cho thuyền và biển do ca sĩ hồng vân nsnd trình bày bạn có thể click vào đây để đăng lời cho bài hát này,tien-chien
Chiếc Áo Bà Ba,Thảo Sương, hiện chưa có lời bài hát nào cho chiếc áo bà ba do ca sĩ thảo sương trình bày bạn có thể click vào đây để đăng lời cho bài hát này,tien-chien
Kỷ Niệm Trong Tôi,Như Mai, hiện chưa có lời bài hát nào cho kỷ niệm trong tôi do ca sĩ như mai trình bày bạn có thể click vào đây để đăng lời cho bài hát này,tien-chien
Giấc Mê Đời,Dạ Lan,anh ngỡ em đang về phương trời cũ tìm phút mê đầu tìm cơn say đắm đưa đón em vào mùa xuân dài lâu từ đó em đau phút giây vui mừng từ đó em yêu dáng hoa thẹn thùng từ đó em quên xác thân đường trần cuộc vui đằm thắm anh ngỡ em đang lặng nghe lời gió gợi nhớ tên người đường xưa em đến sỏi đá vui mừng nhịp chân lả lơi hồn lá bay theo lén hôn tóc thề vạt nắng xôn xao đón đưa em về đồi núi âm vang nhắc xưa hẹn thề hoài thuở đam mê một vòng tay băng giá đong đưa ngày tháng mộng tình xưa thức giấc giữa đêm về sáng rồi mộng cũ im hơi và thời gian cuốn trôi để niềm đau lớn lên trong lẻ loi em đến không em vùng hoa mộng đó còn giấc mê đời một lần thương nuối rồi sẽ quay về người xây cuộc vui rồi dấu yêu xưa phấn soi xóa mờ tình đã xuôi theo sóng xô đôi bờ chỉ có thiên thu lắng trong hồn chờ người đến trong mơ,tien-chien
Tiếng Hát Dạ Lan,Dạ Lan, hiện chưa có lời bài hát nào cho tiếng hát dạ lan do ca sĩ dạ lan trình bày bạn có thể click vào đây để đăng lời cho bài hát này,tien-chien
Thơ Phổ Nhạc Việt Nam (Pre 75),V.A, hiện chưa có lời bài hát nào cho thơ phổ nhạc việt nam pre 75 do ca sĩ va trình bày bạn có thể click vào đây để đăng lời cho bài hát này,tien-chien
Dấu Chân Địa Đàng,Mỹ Lệ, trời buông gió và mây về ngang bên lưng đèo mùa xanh lá loài sâu ngủ quên trong tóc chiều cuộc đời đó nửa đêm tiếng ca lên như than phiền bàng hoàng lạc gió mây miền trùng trùng ngoài khơi nước lên sóng mềm ngựa buông vó người đi chùng chân đã bao lần nửa đêm đó lời ca dạ lan như ngại ngùng vùng u tối loài sâu hát lên khúc ca cuối cùng một đời bỏ ngỏ đêm hồng ngoài trời còn dâng nước lên mắt em tiếng ca bắt nguồn từ đất khô từ mưa gió từ vào trong đá xưa đến bây giờ mắt đã mù tóc xanh đen vầng trán thơ giòng sông đó loài rong yên ngủ sâu mới hôm nào bão trên đầu lời ca đau trên cao ngàn mây xám chiều nay về đây treo lững lờ và tiếng hát về ru mình trong giấc ngủ vừa rồi từ đó loài sâu nửa đêm quên đi ưu phiền để người về hát đêm hồng địa đàng còn in dấu chân bước quên,tien-chien
Tà Áo Xanh,Cẩm Vân,gió bay từ muôn phía tới đây ngập hồn em rồi tình lên chơi vơi thuyền anh một lá ra khơi về em phong kín như mây trời đêm đêm ngồi chờ sáng mơ ai một nửa cũng là không ta nhau mùa thu ta thương nhau mùa đông ta yêu nhau mùa xuân để rồi tàn theo mùa xuân người về lặng lẽ sao đành anh còn nhớ em nói rằng sao mùa xuân lá vẫn rơi sao mùa xuân lá vẫn bay anh ơi có hoa nào không tàn có trời nào không mây có tình nào không phai em còn nhớ anh nói rằng khi nào em đến với anh xin đừng quên chiếc áo xanh anh ơi có đâu ngờ đêm rằm có màu nào không phai như màu xanh ái ân rồi chiều nao xác pháo bên thềm tàn mắt bay em đi trong xác pháo anh đi không nước mắt thôi đành em lúc anh ra đi lạnh giá tâm hồn hoa mai rơi từng cánh trên đường lạnh lùng mà đi luyến tiếc thêm chi hoa tàn nhặng bay theo không gian,tien-chien
Chiếc Lá Cuối Cùng,Ngô Quốc Linh, hiện chưa có lời bài hát nào cho chiếc lá cuối cùng do ca sĩ ngô quốc linh trình bày bạn có thể click vào đây để đăng lời cho bài hát này,tien-chien
Hết Rồi Những Ngày Vui,Lê Uyên & Phương,thôi rồi còn chi mà mơ ước người ơi mây trời màu tang màu tang trắng đưa tình yêu biết bao ân cần rồi cũng đến khi nhìn nhau lạnh lùng thời gian đã như vô tình chia lìa một ngày cùng em trao nhau ước mơ mây chiều âm thầm mang nỗi buồn đi đâu còn ngày mai đường mây trắng vương tình si tiếc thương những ngày cùng ngắm áng mây chiều vương ngập trời tình yêu đã không như ngày ban đầu dù bao ước nguyện còn in sâu em ơi em ơi bướm hoa ngày ấy bâng khuâng mây trôi biết trôi về nơi phương nào sao ơi sao ơi sao như thầm nhắc em còn nhớ hôm nào đèn đường khuya in bóng sương khuya mờ phố vắng em ơi còn đâu nữa đường vắng như lòng thiếu ân tình kỷ niệm vui buồn anh xếp hành trang khung trời màu xanh cỏ hoa kết trên đường đi thiết tha cuộc đời dù biết đắng cay nhiều hơn ngọt ngào ngày mai trả em về kinh kỳ hoa đèn dù trăng vẫn vàng dù mây tan ,tien-chien
Suối Mơ,Thanh Phương, hiện chưa có lời bài hát nào cho suối mơ do ca sĩ thanh phương trình bày bạn có thể click vào đây để đăng lời cho bài hát này,tien-chien
Gửi Người Em Gái,Hoàng Hoa,đoàn chuẩn từ linh cành hoa tim tím bé xinh xinh báo xuân nồng đượm đà phong kín cánh mong manh tấm hoa lòng hà nội chờ đón tết vắng bóng người đi liễu rũ mà chi đêm tân xuân hồ gươm sao long lanh hoa mai rơi rủ nhau nơi phương xa đường phố vắng bóng đèn chạnh lòng tôi nhớ tới người em tôi có người em gái tuổi chớm dâng hương mắt nồng rộn ý yêu thương đôi mắt em nói nhiều tha thiết như dáng kiều ôi tình yêu nhưng một sớm mùa thu giữa chân trời xanh ngát nàng đi gót hài xanh nàng đi cho dạ sao đành đừng quên lối cũ ân tình nghĩa xưa rồi từ ngày ấy nước sông ngăn cách đôi dòng chuyện tình vỡ lỡ bến cô đơn không ai ngờ tình nghèo xa cách mãi em tôi đành ôm mối sầu mà đi em tôi đi màu son lên đôi môi khăn soan bay lả lơi trên hai vai nhìn xác pháo bên thềm gởi lòng tôi nhớ tới người em,tien-chien
Điệp Khúc Tình Yêu,Huỳnh Lợi,nhớ nhớ cái hôn đầu tiên anh chưa dành cho em nhớ bản tình ca đầu tiên anh chưa dành cho em ôi nhớ tuổi trẻ đầu của chúng ta đã đi qua chiến tranh nhớ nhớ cái hôn đầu tiên là hôn lên đôi mắt của người bạn đã hi sinh nhớ bản tình ca đầu tiên là hành khúc lên đường nhưng hôm nay anh sẽ hát anh sẽ hát bài hát của chúng ta hãy hát lời lửa cháy bằng trái tim tình yêu hãy hát lời tình yêu bằng trái tim lửa cháy hãy hát lời lửa cháy bằng trái tim yêu thương hãy hát lời yêu thương bằng lửa cháy trong tim,tien-chien
"LK Đau Xót Lý Chim Quyên, Chiếc Áo Bà Ba, Cây Cầu Dừa, Sông Quê","Khánh Duy, Nhã Ca, Mai Thiên Vân", hiện chưa có lời bài hát nào cho lk đau xót lý chim quyên chiếc áo bà ba cây cầu dừa sông quê do ca sĩ khánh duy nhã ca mai thiên vân trình bày bạn có thể click vào đây để đăng lời cho bài hát này,tien-chien
Quanh Lửa Hồng,V.A,cùng nắm nhau tay quay quanh lửa hồng lửa cháy trông tim anh em chúng ta về đây đêm nay trời rực sáng đứng bên nhau lửa hồng soi bước ta đi lửa thiên bập bùnglửa thiên rực cháy như lòng ta vì tổ quốc anh em ta xung họp lửa hồng đêm nay cùng nắm nhau tay quay quanh lửa hồng lửa cháy trông tim anh em chúng ta về đây đêm nay trời rực sáng đứng bên nhau lửa hồng soi bước ta đi lửa thiên bập bùnglửa thiên rực cháy như lòng ta vì tổ quốc anh em ta xung họp lửa hồng đêm nay cùng nắm nhau tay quay quanh lửa hồng lửa cháy trông tim anh em chúng ta về đây đêm nay trời rực sáng đứng bên nhau lửa hồng soi bước ta đi lửa thiên bập bùnglửa thiên rực cháy như lòng ta vì tổ quốc anh em ta xung họp lửa hồng đêm nay cùng nắm nhau tay quay quanh lửa hồng lửa cháy trông tim anh em chúng ta về đây đêm nay trời rực sáng đứng bên nhau lửa hồng soi bước ta đi lửa thiên bập bùnglửa thiên rực cháy như lòng ta vì tổ quốc anh em ta xung họp lửa hồng đêm nay,tien-chien
Khúc Hát Tuổi Trẻ Sài Gòn,"Hồng Mơ, Tú Uyên, Minh Du",hôm nay đi trên thành phố quên nhà âm vang câu ca khúc nhạc mùa xuân thành phố quê hương đang chung tay dựng xây đường phố thênh thang nâng bước chân tay đi sài gòn ta đó ngày nắng mưa đi về cho lá thêm xanh cho cây đời hoa trái sài gòn ta đó ngày nắng mưa đi về đất nước nở hoa hát bài ca thành phố hồ chí minh hôm nay di trên thành phố quê nhà âm vang câu ca lời bác hồ ngày ấy nhà rồng yêu thương nơi xưa bác ra đi để có hôm nay trong nắng ấm hòa bình sài gòn ta đó ngày mới thêm công trình lớp lớp tuổi xuân hiến dâng tuổi đôi mươi sài gòn ta đó ngàn khúc ca ân tình hát mãi bài ca tuổi thanh niêm thành phố hồ chí minh,tien-chien
Mưa Rơi,Hồng Hạnh,mưa rơi từ nghìn xưamưa rơi về nẻo mơ mưa đem sầu thiên thu đến cho ta mưa đi từ tuổi thơ mưa theo cuộc tình tơ mưa rơi bạc đầu ai thương nhớ mưa mưa rơi từ nguồn xamưa tuôn về bao la mưa chia dòng lệ ra chín con thơ mưa trôi về đời ta mưa xây nhà âm u mưa giăng vải màn sô nuôi giấc mơ mưa rơi vào lòng ta mưa rơi vào tình ta có hay chăng là mưa rơi vì chúng ta mưa rơi và còn rơi không bao giờ mưa ngơi không bao giờ ta nguôi yêu người ơi mưa rơi ngoài đường đêm đưa em về nhà em mưa vui mừng quấn quýt dưới chân êm mưa rơi lạnh trời đen mưa trong lòng lên men mưa cho lửa tình thêm chút yếu mềm mưa rơi ngoài hè đêm như đôi bàn tay tiên ru nhè nhẹ một ca khúc không tên mưa to nhỏ triền miên mưa trên đầu vô biên mưa ấp ủ tình duyên thêm vững bền mưa rơi vào lòng ta mưa rơi vào tình ta có hay chăng là mưa rơi vì chúng ta mưa rơi và còn rơi không bao giờ mưa ngơi không bao giờ ta nguôi yêu người ơi,tien-chien
Hát Cho Dân Tôi Nghe,"Bích Liên (NSƯT), Kiều Hưng (NSƯT)",hát cho dân tôi nghe tiếng hát tung cờ ngày nào hát cho đêm thiên thu lửa cháy bên trại giặc thù hát âm u trong đêm muôn cánh tay đang dậy lên hát cho anh công nhân xiềng xích như mây tan hoang hát cho anh nông dân bỏ cày theo tiếng loa vang ngày nào thênh thang dân đứng lên phá xiềng nô lệ ngày nào hiên ngang ta cùng nhau đứng chung đồng bào dành lại dòng sông này cho lúa chín khắp đồng xanh dành lại thành phố đó bàn tay nâng cao hòa bình ngày nào loa vang dân xóm thôn cũng vừa lên đường ðời không yên vui nên rừng hoang cũng người rồi còn lại dòng sông này cho máu thắm khắp đồng xanh còn lại thành phố đó việt nam nâng cao hòa bình hát cho sông không sâu cho tiếng kêu đò thật gần hát cho đêm qua lâu cô lái đưa người vào bờ hát sâu trong xa xưa tiếng hát trưng vương hồng thơm hát vang danh lam sơn người cũng như mây lên non hát cho trăm năm son sử vàng cũng biết môi thơm,tien-chien
Tự Nguyện,Trần Khánh (NSND), hiện chưa có lời bài hát nào cho tự nguyện do ca sĩ trần khánh nsnd trình bày bạn có thể click vào đây để đăng lời cho bài hát này,tien-chien
Dạ Khúc,Quỳnh Giao,gió gây hương nhớ nâng tiếng đàn xa đưa sầu vương vấn gây mơ khóc trên dây tơ trong sầu nhớ bóng ai thoáng về cô phòng nào đâu thấy tình xưa mơ mòng đàn ai lên cung oán tang tình gieo hờn đàn ai ngân theo gió xế xang gieo buồn bồn chồn trong đêm tối lần dò chơn theo lối mấp mô ôi cung đàn réo vang đêm trường giây tơ gào gió đê mê lòng lệ tràn vì đâu bao tình tê tái nương làn gío bay tìm ánh trăng sao đàn ai lên cung oán tang tình gieo hờn đàn ai ngân theo gió xế xang gieo buồn bồn chồn trong đêm tối lần dò chơn theo lối mấp mô,tien-chien
Người Bạn Cuba Trên Đường Hồ Chí Minh,V.A, hiện chưa có lời bài hát nào cho người bạn cuba trên đường hồ chí minh do ca sĩ va trình bày bạn có thể click vào đây để đăng lời cho bài hát này,tien-chien
Biệt Ly,Đỗ Thu,biệt ly nhớ nhung từ đây chiếc lá rơi theo heo may người về có hay biệt ly sóng trên dòng sông ôi còi tàu như xé đôi lòng và mây trôi nước trôi ngày tháng trôi cùng lướt trôi mấy phút bên nhau rồi thôi đến khi bóng em mờ khuất người về u buồn khắp trời người ra đi với ngàn nhớ thương mấy phút bên em rồi thôi dáng em sống trong hồn tôi xa cách ta còn tìm đâu ngày vui biệt ly ước bao đường tơ réo rắt trong muôn hương mơ thành sầu tiễn đưa biệt ly ước mong hoàng hôn êm đềm về ru ấm tâm hồn người yêu đương cách xa đành sống vui cùng gió sương,tien-chien
Ai Đi Ngoài Sương Gió,Hoatygon,trời thu mưa bay bay mà lòng ai như say hoa lá rơi đầy từng giọt mưa rơi rơi hòa nhịp tim chơi vơi gió cuốn mây trôi ai đi ngoài mưa ngậm ngùi nghe mưa rơi giọng hoài buông lơi chan chứa u hoài lệ sầu ai hoen mi lạnh lùng nhịp chân đi tiếc nhớ thương chi lướt đi ngoài trời gió mưa tơi bời ai đi ngoài sương gió tả tơi chớ buồn vì mưa ai đi ngoài sương gió chớ nức nở nhạc sầu ai đi ngoài sương gió hỡi ai xoá nổi niềm đau ai ơi mộng tàn xưa không vương lụy thời gian ngoài trời mưa rơi rơi mà hồn ai chơi vơi sao nhớ nhung hoài từng giọt mưa rơi rơi lả lời ca xa xôi thắm thiết thương ai lướt đi ngoài mưa dù trời còn mưa rơi đừng buồn lòng ai ơi ta vẫn tươi cười rồi ngày trời thôi mưa đời lại đẹp như thơ quyến luyến trong mơ ấm êm tâm hồn hát câu yêu đời,tien-chien
Ngày Buồn,Thành Lân, hiện chưa có lời bài hát nào cho ngày buồn do ca sĩ thành lân trình bày bạn có thể click vào đây để đăng lời cho bài hát này,tien-chien
