title,singer,lyric,genre
Tơ Sầu,Thái Thanh,với ánh tơ sầu sắc thắm muôn màu làm cho tim ta tê tái thương đau với ánh tơ sầu ném xuống nhân loại làm cho bao giống người sầu đau ngàn muôn nhạc sỹ kia ơi buồn thương tương tư chờ ai đời người tươi thắm sáng như ngàn sao nguồn nhạc tinh túy xướng trong hồn người không bao giờ phai là suối rừng mai tơ dáng như mây chiều tơ úa như lá vàng tơ giống như trăng ngà nhiều khi tơ giống tóc người yêu nhớ tới đêm nào gió thét mưa gào hồn tim ta say đôi mắt nhung êm cố nắn tơ đồng khóc oán phong trần hồn ta mưa gió lạnh lùng đau tơ dáng như mây chiều tơ úa như lá vàng tơ giống như trăng ngàn nhiều khi tơ giống tóc người yêu,tien-chien
Thinh Không,Thái Hiền,trống trải mênh mông rộng rãi vô cùng cao thấp vô lường à à a a bỗng đầy ắp sinh trùng tất cả là tôi mà cũng là chung vắng vẻ trầm ngâm lặng lẽ âm thầm yên tĩnh vô cùng à à a a bỗng rộn rã tưng bừng nhất nhất trùng trùng nhưng cũng là không,tien-chien
Sơn Nữ Ca,"Bùi Thiện, Sơn Ca",một đêm trong rừng vắng ánh trăng chênh chếch đầu ghềnh thấp thoáng bóng cô sơn nữ miệng cười xinh xinh một đêm trong rừng núi có anh lữ khách nhìn trời xa xa ngắm trăng say đắm một mình bâng khuâng một đêm trong rừng vắng có cô sơn nữ miệng cười khúc khích ngắm anh lữ khách rồi lòng bâng khuâng một đêm trong rừng núi có anh lữ khách nhìn trời xa xa biết đâu sơn nữ nhìn mình đăm đăm sơn nữ ơi đời ta như cánh chim chiều phiêu bạt thời gian vun vút mây sơn nữ ơi đừng làm thắc mắc cho lòng khô cạn từ nay nước mắt đầy vơi sơn nữ ơi thời gian lôi cuốn bao lần bên rừng đầy hương bát ngát trời thu sơn nữ ơi đành lòng sống với bên rừng thơ mộng cùng hoa với lá ngàn hương hãy nhìn trăng lên rồi lu mờ dần hãy nhìn trăng lên thiết tha về ngàn chờ đợi tay người sơn nữ khi nhìn chim bay bay đi tìm đàn khi nhìn gió cuốn lá thu rời cành cuộn bay lên người sơn nữ sơn nữ ơi làm chi cho đớn đau lòng trong một thời gian rồi thương rồi nhớ sơn nữ ơi hoàng hôn xuống dần chờ đợi ai đây,tien-chien
Lý Con Ngựa (Dân Ca Trung Bộ),Đào Đức,con ngứa ngựa ô con ngứa ngựa ô ma la ô có chứng má lá nổi lăn loàn hỡi bạn chung tình ơi nó có chứng lăn loàn ma la yến yện lên ma la yến yện lên má lá lên một cái nó cốc một cái té xuống một cái nó mới đá một cái nó đâu cha chả yên ta lên cái nữa yên quất một roi yên gò cương lại tình tang nỏn tính tính tang nỏn tang tình mà là hảy hay bạn hỡi bạn chung tình ơi ớ lá hay rằng hay con ngứa ngựa ô con ngứa ngựa ô ma la ô yên khấu má lá khẩu kêu bạn hỡi bạn chung tình ơi má lá khẩu kêu bạn ma la dấy dầy thương ma la dấy dầy thương má lá thương bình bạc lục lạc đồng đen cái dây cương tím cái lá trắng tấn tấn đưa nàng tình tang nỏn tính tính tang nỏn tang tình mà là đứa đưa nàng hỡi bạn chung tình ơi ớ lá dinh dzề dinh,tien-chien
Bài Ca Thanh Niên Tình Nguyện,La Thăng,còn nghe trong gió reo muôn sóng chập chừng còn in dấu tháng năm sử sách oai hùng cuộc đời nở hoa dâng ngàn muôn sắc hương thanh niên tình nguyện góp sức xây đời vượt mọi gian khó ta nào có ngại gì về đây những cánh chim từ bốn phương trời dù hải đảo xa hay rừng sâu núi cao xóa hết đau thương nối vững vàng tình thương giục giã trong lòng ta tiếng gọi non sông ta lên đường dựng xây tươi đẹp hơn nước việt mến yêu đường đến chân trời xa vững niềm tin đất nước sáng ngời rộn vang những lời ca thanh niên tình nguyện việt nam,tien-chien
Nhớ Về Quê Hương,Nguyễn Tâm,có tự khi nào quê hương trong kí ức tuổi thơ êm đềm tựa như tiếng mẹ ru một khoảng không gian qua cau trắng bên giường ép vào giấc ngủ tình quê sao thương quá thuở đi chân đất ra đồng cùng nghé ngọ chiều về trên đồi mãi miết cánh diều xa áo vá sờn vai tuổi niên thiếu vào đời từng tiếng ê a câu tình cha nghĩa mẹ quê hương ngọt ngào bờ tre xanh giếng nước dẫu ai gọi đò tha thiết bến sông xưa mái lá ủ rơm võng ầu ơ kẻo kẹt khói bếp sao hè mùi khoai nướng lùi tro làng quê đậm đà đời một sương hai nắng chân chất hiền hòa thấm từng khúc ca dao nhớ điệu hoài lang đêm trăng sáng gành hào da diết yêu thương chạnh lòng niềm hoài cảm từ lúc rời nôi thôi quên dòng sữa mẹ bỏ con đê nghèo phận trôi nổi lênh đênh thì thầm trong tim hồn quê vẫn nồng nàng trăn trở khôn nguôi chập chờn bao kỉ niệm có phải quê hương dẫu bao người chỉ một hai tiếng giàu nghèo thắm thía nỗi quê hương từng phút vấn vương quê xưa ngày trở lại ôm trọn vào lòng nguồn cội là quê hương cuộc sống bôn ba bao năm qua xứ lạ quê người mười mấy năm dài là bao ngày thương nhớ khôn nguôi làng nhỏ quê tôi chiều mưa buồn ễnh ương nhái lội hòa điệu ru đêm thâu từ lúc tha phương mang quê hương về nơi xứ lạ mơ thấy con đò dòng sông nhỏ mẹ già em thơ chiều đứng bơ vơ chợt tôi về ai hát não nề điệu hát lý xàng xê quê hương ơi xa rồi mới biết nhớ da diết ruộng đồng rủ vàng trĩu bông hàng cây vông bên đường bổng đỏ bờ đê nhỏ rồi bóng dừa xanh đêm trăng thanh nhà tranh hiu hắt bóng kẻo kịt giông mù bồi hồi nhớ thương dù có tha phương xa quê hương lòng vẫn vướng nặng mưa nắng hai mùa buồn nhớ về đất mẹ xa xôi từ trái tim tôi từ lâu rồi mãi mong có ngày về lại quê nhà xưa,tien-chien
Gửi Người Em Gái,Tạ Minh Tâm,cành hoa tim tím bé xinh xinh báo xuân nồng rừng đào phong kín cánh mong manh hé hoa lòng hà nội chờ đón tết hoa chen người đi liễu rũ mà chi đêm tân xuân hồ gươm như say mê chuông reo ngân ngọc sơn sao uy nghi ngàn phía đến lễ đền chạnh lòng tôi nhớ đến người em tôi có người em gái tuổi chớm dâng hương mắt nồng rộn ý yêu thương đôi mắt em nói nhiều tha thiết như dáng kiều ôi tình yêu nhưng một sớm mùa thu khép giữa trời tím ngắt nàng đi gót hài xanh người đi trong dạ sao đành đường xưa lối cũ ân tình nghĩa xưa rồi từ ngày sống xa anh nơi kim tiền ngục trần gian hãm tấm thân xinh đôi mắt hiền đời nghèo không lối thoát em đành thôi cúi đầu mà đi xuân đêm nay đường đêm catina hoa mai rơi rủ nhau nơi phương xa dần trắng xóa mặt đường một người em gái nhớ người thương rồi ngày thống nhất đến rất nhanh khôn ai ngừng cầu chia giới tuyến đến mai đây san đất bằng nụ cười trong gió sớm anh đến chờ em giữa cầu hiền lương em tôi đi màu son lên đôi môi khăn san bay lả lơi bên hai vai ai trời thắm gió trăng hiền hà nội thêm bóng dáng nàng tiên em tháp rùa yêu dấu còn đó trơ trơ lớp người đổi mới khác xưa thu đã qua những chiều song ý thơ rất nhiều cả tình yêu em nhẹ bước mà đi giữa khung trời bát ngát tình ta hết dở dang đường xưa lối ngập lá vàng đường nay thong thả bao nàng đón xuân lòng anh như giấy trắng thanh tàn ép hoa tàn thời gian vẫn giữ nét yêu đương nơi hoa vàng dịu lòng đàn dẫn phím ý thơ trào dâng viết gửi về em đêm hôm nao ngồi nghe qua không gian em tôi mơ miền xưa qua hương lan đường phố lóa ánh đèn một người trên đất bắc chờ em,tien-chien
Đêm Trao Kỷ Niệm,Xuân Sáng,còn đêm nay ta với mình đi vào tình yêu để nhung nhớ đến trăm muôn chiều mai mốt này cuộc đời quạnh hiu xa nhau xin nhớ ngày ban đầu xao xuyến xin nhớ người mong cho ưu phiền xin nhớ đêm tiễn đưa êm đềm ngàn ngày xưa trong sách sử đến ngàn ngày sau khi tổ quốc kêu lên tiếng sầu đâu thiếu gì cảnh biệt ly nhau ra đi mang bóng hình của người con gái trong bóng hình núi rộng sông dài hay mến yêu gan mot hinh hai ngày về ruộng đồng nở hoa ngày về thanh bình hoan ca non nước một nhà tươi thắm mặn mà như tình đôi ta ngô sắn đầy nhà em bé cụ già vui bài tình ca tưng bừng thiết tha bàn tay âu yếm một bàn tay làm sao nói hết giây phút này thương tiếc thầm mộng đẹp rời tay anh ơi xin nhớ ngày ta cùng sánh bước khi phố phường lên ngập ánh đèn đêm đổi trao luyến thương sau cùng,tien-chien
Tiếng Đàn Ta Lư,Tường Vy,đi chiến trường gùi trên vai nặng trĩu đàn ta lư em hát tiếng ca vang cùng núi rừng mừng thắng trận quê em từ trên đỉnh núi cao chót vót thánh thót nhịp nhàng vang lời em ca theo nhịp bước quân đi trong tiếng đàn ta lư tính tính tính tính tính tính tính tính tang tang tình con chim chrao xinh hót trên cành vui mừng công anh bộ đội giải phóng quân ơi anh thắng trận miền tây khe sanh đồn tà cơn hôm nào bốc cháy đồi đồng chi xác mỹ chất đầy kia trông 1 2 3 4 5 sáu ngàn tên lính thủy đánh bộ mỹ kia nó bỏ xác trên rừng bộ đội giải phóng ơi các anh đánh hay hung hu hú đàn em reo ca ơi đàn ta lư rừng núi quê ta tưng bừng reo ca tiếng trống trận từ gio an vọng tới rừng núi ta ơi hãy thắm xanh vui cùng bản làng mừng thắng trận gio an từ trên đỉnh núi cao chót vót thánh thót nhịp nhàng vang lời em ca vọng về đất gio an vang tiếng đàn ta lư tính tính tính tính tính tính tính tính tang tang tình ơi anh pháo binh pháo ta gầm đạn nở như hoa đồn quân giặc bốc cao cao trong tiếng đàn ta lư em reo hoà cùng anh tiếng kèn chiến thắng từ trị thiên khói lửa anh hùng kia trông 1 2 3 4 5 sáu chục tên lính thủy đánh bộ mỹ kia nó bị bắt trên rừng bộ đội giải phóng ơi các anh đánh hay hung hú hú đàn em reo ca ơi đàn ta tư rừng núi quê ta tưng bừng reo ca,tien-chien
Thu Sầu,Thái Thanh,mùa thu thưa nắng gió mang niềm nhớ trời chiều man mác buồn nát con tim lệ tình đẫm ước tà aó trinh nguyên kỷ niệm êm đềm còn in trên giấy người ôm thương nhớ ra đi từ đấy trời đày hai đứa vì thiếu tơ duyên rừng còn thay lá tình vẫn chưa yên thương chi cho lắm giờ cũng vô duyên người từ ngàn về mang nỗi sầụ nhịp cầu ô thước hẹn đến mai sau ngày đài nhung nhớ mình cũng như nhau trên cao bao vì sao sáng rung vắng có bao là vàng là bấy nhiêu sầụ người đi hoa lá chết theo mùa nhớ người về lặng lẽ tình vẫn bơ vơ thà rằng chôn kín mộng ước bên nhau quên đi cho hết một kiếp thương đaụ,tien-chien
"Dân Ca Ba Miền (Lý Cây Đa,Quan Họ Bắc Ninh)",Thanh Thanh, hiện chưa có lời bài hát nào cho dân ca ba miền lý cây đaquan họ bắc ninh do ca sĩ thanh thanh trình bày bạn có thể click vào đây để đăng lời cho bài hát này,tien-chien
Vần Thơ Sầu Rụng,Mai Hương,vầng thơ sầu rụng vầng trăng từ độ lên ngôi năm năm bến cũ em ngồi quay tơ em ngồi quay tơ quay đềuquay đềuquay đều để tóc rối vần câu thơ sầu rụng mái tóc cũng buồn theo thơ cũng buồn theo thơ quay đềuquay đềuquay đều năm năm tiếng lụa se đều trong cây gió lạnh đưa vèo hằng năm tiếng lụa đưa theo đêm đêm gió rét đưa vèo trong cây đưa vèo trong cây quay đềuquay đềuquay đều nhẹ tay nhè nhẹ đôi tay hương thơm lối xóm bay đầy thinh không bay đầy thinh không quay đềuquay đềuquay đều nghiêng nghiêng mái tóc hương nồng quay đềuquay đềuquay đều thời gian lặng rót một dòng buồn tênh một dòng buồn tênh quay đềuquay đềuquay đều,tien-chien
Mối Tình Xa Xưa,Thái Thanh,trong chiều dần im hơi người ngồi thương nhớ bao ngày vui một ngày xưa cũ đời còn đương tơ là ngày hai đứa chúng ta còn thơ chiều hè êm du tràn ngập hương mơ cuộc tình đôi lứa như bài thơ gần người yêu dấu mộng về xôn xao và hồn như cất cánh bay về đâu lời thề bên nhau tình nồng đêm thâu cả một vừng sao làm tròn duyên nhau người từ phương nao trở về cho ta hết u sầu yêu người là không nguôi trầm mình trong thú đau thương người ơi cuộc tình duyên cũ dù thời gian qua mà lòng thương nhớ vẫn chưa hoen mờ chiều buồn không đâu ngậm ngùi thương nhau đời vì trôi mau mà đành quên sao trở về cho hoa không phai mầu yêu người là không nguôi sầu tình chan chứa trong chiều rơi nhạc lòng êm ái dù đời tàn phai mà còn mãi mãi ngân trong đêm dài,tien-chien
Từ Một Ngã Tư Đường Phố,"Thúy Hà, Mạnh Hà (NSƯT)", hiện chưa có lời bài hát nào cho từ một ngã tư đường phố do ca sĩ thúy hà mạnh hà nsưt trình bày bạn có thể click vào đây để đăng lời cho bài hát này,tien-chien
Ngày Mùa,Kiều Hưng (NSƯT),ngày mùa vui thôn trang lúa reo như hát mừng lúa không lo giặc về khi mùa vàng thôn quê ngày mùa vui thôn xóm đầy đồng giáo với gươm súng tì tay anh đứng em ngừng liềm trông sang lúa lúa vàng đồng lúa bát ngát trời bao tay liềm từng nhánh lúa thơm rơi ngày vui quân du kích đứng im trông lúa dập dờn người người qua gánh lúa nón nghiêng nghiêng cười ai ngày mùa vui thôn trang cũng như trên cánh đồng nhớ công ơn già hồ khi mùa vàng quê hương ngày mùa quân du kích đặt từng gánh trước sân dân làng vui như tết qua mùa này không lo gánh thóc vàng từng lớp gánh về gánh thóc vàng từng sớm nắng trên đê ngày vui quân du kích đứng im trông lúa dập dờn rồi rời sang xóm khác nhớ lúc ai nhìn theo,tien-chien
Lối Về Xóm Nhỏ,Lam Trường,về thôn xưa ta hát khúc hoan ca ngọt hương lúa tình quê thêm đậm đà rào rạt bao niềm thương trong mái lá bờ dâu xanh cô gái hát êm êm tầm mai chín gởi anh dâng mẹ hiền lòng già thêm hơi ấm khi chiều lên có những chiều hôm trời nghiêng nắng xế đầu non nắng xuống làng thôn làm cho đôi má em thêm ròn lúa đã lên bông mắt già tươi sáng thôi chờ mong tiếng hò cô lái bên cửu long mơ rằng mai lúa lên đầy bông chiều hôm nay quay gót bước phiêu du về thôn xóm để vui chung ngày mùa đường về thôn quyện chân bên nhánh lúa vầng trăng nghiêng soi mái tóc em thơ vài cô gái nhỏ to vui chuyện trò đường về thôn niềm vui dâng đây đó,tien-chien
Biệt Ly,Mai Hương,biệt ly nhớ nhung từ đây chiếc lá rơi theo heo may người về có hay biệt ly sóng trên giòng sông ôi còi tàu như xé đôi lòng và mây trôi nước trôi ngày tháng trôi cùng lướt trôi mấy phút bên nhau rồi thôi đến khi bóng em mờ khuất người về u buồn khắp trời người ra đi với ngàn nhớ thương mấy phút bên em rồi thôi dáng em sống trong hồn tôi xa cách ta còn tìm đâu ngày vui biệt ly ước bao đường tơ réo rắt trong muôn hương mơ thành sầu tiễn đưa biệt ly ước mong hoàng hôn êm đềm về ru ấm tâm hồn người yêu đương cách xa đành sống vui cùng gió sương,tien-chien
Ngày Mùa,Trọng Tấn,ngày mùa vui thôn trang lúa reo như hát mừng lúa không lo giặc về khi mùa vàng thôn quệ ngày mùa vui thôn xóm đầy đồng giáo với gươm súng tì tay anh đứng em ngừng liềm trông sang lúa lúa vàng đồng lúa bát ngát trờị bao tay liềm từng nhánh lúa thơm rơị ngày vui quân du kích đứng im trông lúa dập dờn người người qua gánh lúa nón nghiêng nghiêng cười ai ngày mùa vui thôn trang cũng như trên cánh đồng nhớ công ơn già hồ khi mùa vàng quê hương ngày mùa quân du kích đặt từng gánh trước sân dân làng vui như tết qua mùa này không lọ gánh thóc vàng từng lớp gánh về gánh thóc vàng từng sớm nắng trên đệ ngày vui quân du kích đứng im trông lúa dập dờn rồi rời sang xóm khác nhớ lúc ai nhìn theọ,tien-chien
Cùng Anh Tiến Quân Trên Đường Dài,Doãn Tần (NSƯT),qua núi qua sông qua đồng lúa chín ta nghe xao xuyến tiếng hò thiết tha ngọn lửa trong tim những chiều hành quân sáng lên lời ca những người anh hùng qua núi trung du xanh màu lá biếc quê anh yêu dấu tím đỏ đồi sim chân bước đi xa lòng còn để lại quê hương anh đó ngỡ quê hương mình nguyễn viết xuân lời anh nói thiết tha như ngọn gió bay xa như khúc ca giục giã thôi thúc trong lòng tôi tiến quân trên đường dài đường hành quân qua núi cao vực sâu tôi đi hờn căm sôi trong máu nguyễn viết xuân trận địa khắp nơi nơi anh lại đứng bên tôi nhằm quân thù mà bắn đôi mắt như lửa soi đốt thiêu quân thù này trận địa đây đất nước của mình đây lời anh vẫn vang lên nồng cháy kể từ nay sông núi hay biển khơi còn in dấu chân anh đời đời,tien-chien
Chuyện Tình Sereneda,Thái Thanh,1 chiều buồn nhẹ xuống đời người tình tìm đến người thấy run run trong chiều phaị vẻ sầu của đóa cười tình bền của lứa đôi thoáng hương trong chiều rơị chiều nay hát cho xanh câu yêu đời cho người thôi khóc thương ai cho niềm yêu đến bên tôi chiều nay lỡ ghé môi trên mi sầu ru người qua chốn thương đau cho làn nước mắt chìm sâụ ðk 1 dù một ngày đời sẽ vỡ tan rồi người về khuất chân trời nhớ nuôi cho hương một chiều vương vấn đời cuộc tình vĩnh viễn xa vời chỉ còn thương nhớmà thôị 2 tình đời tỏa ngát màu chiều nay là lúc đầu nói cho nhau nghe đời sau nhẹ nhàng người đắm sầu kể lể chuyện kiếp nao có ai chia lìa nhau một ngày đó tóc mây đã phai màu có chờ ta oán trách đâu có vì duyên kiếp không lâu ðời sẽ thấy chúng ta sống không cầu cho tình cứ úa phai mau cho người cứ mãị phụ nhaụ ðk 2 dù một ngày đời sẽ vỡ tan rồi người về khuất chân trời nhớ nuôi cho hương một chiều vương vấn đời cuộc tình vĩnh viễn xa vời chỉ còn thương nhớ mà thôị bóng tối buồn không lờị,tien-chien
Anh Về Thủ Đô,"Y Phụng, Lâm Thúy Vân",anh về thủ ðô chúng tôi chờ mong với vạn niềm tin với muôn tình thương ðiểm tô phố phường người trai áo xanh phố hoa pha màu lá rừng anh về thủ ðô ấm êm lòng tôi ðứng lại gần nhau nói câu chuyện vui chuyện hai chúng minh gặp nhau chốn đây lúc quân dân cùng nắm tay ôi nầy anh áo xanh chiến trường bạc mầu mến anh mến từ thuở nào người trai tranh đấu ôi nầy anh ðã mang đến tình mặn mà ðến anh những lời thật thà lòng dân mong chờ anh về thủ ðô biết bao là vui ðã để lại đây mến thương đầy vơi người dân nước việt ghi ơn các anh ðã hy sinh vì giống nòi anh về thủ ðô nước nam tự do chút quà mừng anh chiến binh đường xa là muôn tấm lòng yêu thương đón anh ðón anh trai hùng bước qua ,tien-chien
Mưa Trên Phố Huế,Trường Vũ,chiều nay mưa trên phố huế kiếp giang hồ không bến đợi mà mưa sao vẫn rơi rơi hoài cho lòng nhớ ai ngày chia tay hôm nao còn đây nước trên sông hương còn đầy tình đã xa gió mưa u hoài mắt lệ ngắn dài chiều mưa trên kinh đô huế tiếng mưa còn vương kỷ niệm ngày nhau dưới chân thiêng mụ anh còn nhớ không chợ đông ba khi mình qua lá me bay bay là đà chiều thiết tha có anh bên mình mà ngỡ hôm qua hò ơi ơi hò chiều mưa phố buồn chiều mưa phố xưa u buồn có ai mong đợi một người biền biệt nơi mô để nhớ với thương một người chiều nay mưa trên phố huế biết ai đã quên ai rồi hạt mưa rơi vẫn rơi rơi đều cho lòng u hoài ngày xưa mưa rơi thì sao bây chừ nghe mưa lại buồn vì tiếng mưa tiếng mưa trong lòng làm mình cô đơn,tien-chien
Hò Nện (Dân Ca Trung Bộ),"Nhất Sinh, V.A", hiện chưa có lời bài hát nào cho hò nện dân ca trung bộ do ca sĩ nhất sinh va trình bày bạn có thể click vào đây để đăng lời cho bài hát này,tien-chien
Người Em Sầu Mộng,Hồng Nhung,em là gái bên khung cửa anh là mây bốn phương trời anh theo cánh gió chơi vơi em vẫn nằm trong nhung lụa em chỉ là em gái thôi người em sầu mộng muôn đời tình như tuyết giăng đầu núi vằng vặc muôn thu nét tuyệt vời ai bảo em là giai nhân cho đời anh đau buồn ai bảo em ngồi bên song cho vương nợ thi nhân ai bảo em là giai nhân cho lệ đêm xuống trào cho tình giăng đầy trước ngõ cho mộng tràn gối chăn,tien-chien
Tuổi Xa Người,Thiên Tôn,một chiều êm tay đan tay dìu nhau trên lối đưa em đi nhè nhẹ vào đời bằng vòng tay tôi nâng niu mùa thu thức giấc đưa em vào ngày tháng vỗ về kể từ em đem cô đơn mọc lên phố vắng khi em mang nụ cười khỏi đời từng chiều rơi nghe như trong lòng mình tê tái ngỡ như đời còn gọi tên nhau ngày đó khi một lần một lần tiếng hát đồng lõa đưa em vào vùng trời lấp lánh bằng những cánh sao trời đầy đôi mắt ngước trìu mến em em xa dần ngàn đời hoang vắng đôi khi về buồn trên kẽ tóc bước chân này còn trọn kiếp hoang vu một mình đi lang thang trong mùa đông rét mướt nghe bơ vơ hồn mình lạc loài buồn dậy lên trên dung nhan gầy xanh củatuổi trên tháng ngày hằn vết đời mình trời mùa đông hong khô đi niềm tin sỏi đá trên đôi tay này mình còn gì và dòng sông trôi đi vô tình mang tất cả suốt đời này của người hay tôi,tien-chien
